Teks_Gabungan|Label_Sentimen
Dorong Keberlanjutan, Kualitas Tambang Vale Ikuti Standar Global|Positif
Purbaya Suruh Cepat Buang Dolar, Sebenarnya Kenapa Rupiah Melemah?|Negatif
Wow! Transaksi Livin' Mandiri Bisa Tembus 13 Juta Sehari|Positif
Bidik Segmen UMKM Tumbuh Berkelanjutan, BSI Pakai Jurus Ini|Positif
Transaksi Digital Melonjak, tapi Ternyata Warga RI Masih Suka Cash|Netral
99,8% Transaksi Sudah Digital, BCA Perkuat Benteng Lawan Cyber Fraud|Positif
Buka Tabungan BRI di Jogja Financial Festival, Berhadiah Stanley!|Positif
Tokoh-Tokoh Keuangan Bertukar Pandangan di Jogja Financial Festival|Netral
Bos BRI Bicara Evolusi Perbankan, Singgung Digitalisasi hingga AI|Positif
Mumpung Lagi Murah! Beli Emas Lewat Bank Muamalat-BSI di Jogja FinFest|Positif
Mau Investasi Saham? Investor Harus Kuatkan Mental Dulu|Netral
BNI Punya 8 Financial Center, Siap Hubungkan Bisnis RI ke Dunia|Positif
Antam Tebar Promo Menarik di Jogja Financial Festival-Langsung Diserbu|Positif
DPR Pastikan Kondisi Ekonomi RI Baik-baik Saja, Ini Buktinya!|Positif
Ekonomi RI Ibarat Secangkir Kopi, Cerminan Daya Beli Sampai Inflasi|Netral
Tuyul Muncul di Era Kolonial, Takut Logam-Tak Bisa Curi Uang di Bank?|Netral
Belajar Keuangan Sambil Konseran di Jogja Financial Festival Hari ke-2|Positif
Ayo ke Jogja Financial Festival Day 2, Antam Jual Emas Harga Segini!|Positif
Potret Antusiasme Pengunjung di Jogja Financial Festival 2026 Day 2|Positif
Live Now! Sederet Tokoh Penting Kumpul di Jogja Financial Festival|Positif
Bos LPS Ajak Warga Merapat ke JEC Ikut Jogja Financial Festival 2026|Netral
Ramai-ramai Datang ke Jogja Financial Festival, Ini Ternyata Alasannya|Netral
Masyarakat Serbu JEC Hadiri Jogja Financial Festival 2026 Hari Kedua|Positif
Mejeng di Jogja Financial Festival 2026, Antam Tebar Promo Menarik|Positif
Jogja Financial Festival Day-2! Ada Diskusi Bankers Hingga Juicy Lucy|Netral
GMFI Cetak Laba Rp570 Miliar Sepanjang 2025, Melesat 26,3%|Positif
CT & Purbaya Bedah APBN: Setoran Pajak, Utang Sampai Kas Terbongkar|Netral
OJK Godok Tokenisasi RWA, Hadirkan Kripto 'Halal' di RI|Positif
Jogja Financial Festival Ajak Kenali Aset Digital Hingga Love Scam|Netral
Cari Peluang Karier? Sampoerna Buka Booth di Jogja Financial Festival|Positif
BI Ungkap Pembatasan Beli Dolar US$ 25.000 Tak Berlaku Selamanya|Netral
Booth LPS di Jogja Financial Festival Hadirkan Edukasi dan Keseruan|Positif
Uang Masa Depan Warga RI Raib Rp 9,5 T, Bos OJK Ungkap Penyebabnya|Negatif
BI, OJK, Komdigi & Stafsus Prabowo Kumpul di Jogja, Bahas AI-Kripto|Netral
Purbaya Pede IHSG Bisa 8.000, Bakal Lari Kencang Minggu Depan!|Positif
Di Jogja Financial Festival Bisa Konsultasi Keuangan di Booth BNI|Positif
Bos OJK Minta Anak Muda Lakukan Ini Biar Hidup Gak Berantakan|Positif
Cara Unik BI Edukasi Soal Anti-Scam di Jogja Financial Festival|Positif
Kepala Pengawas Aset Digital Bagikan Tips Transaksi Kripto yang Aman|Positif
Terjebak YOLO dan FOMO, Bos OJK Sebut Bahaya yang Mengincar Anak Muda|Negatif
Mejeng di Jogja Financial Festival, BMRI Pikat Pelajar Pakai Cara Ini|Positif
Cerita Seru Pelajar Nemu 'Harta Karun' di Booth Jogja FinFest 2026|Positif
OJK Ungkap Mayoritas Investor Kripto RI Berusia di Bawah 20 Tahun|Netral
Purbaya Yakin Bunga KPR Tak Naik Meski BI Rate Dikerek ke 5,25%|Positif
Simak! Begini Skema & Tujuan BI Batasi Pembelian Dolar Jadi US$25.000|Netral
Lindungi Masyarakat, OJK Dorong 4 Pilar Kesehatan Keuangan|Positif
Penyebab IHSG Ditutup Naik 1,1% Hari Ini|Positif
Ribuan Anak Muda Dilatih Jadi 'Jagoan' Digital Lewat Program Ini|Positif
BI Beberkan Kondisi Ekonomi Terkini ke Ribuan Pelajar-Mahasiswa|Netral
Live Now! Jogja Financial Festival Kupas Potensi Investasi Kripto|Positif
Breaking News! IHSG Balik Arah, Naik 1%|Positif
BSI Ungkap Alasan Ambil Naming Rights Stasiun LRT Dukuh Atas|Netral
Dari Sultan hingga Menkeu Hadir di Jogja Financial Festival 2026|Netral
BI Beri Bukti Situasi Rupiah Sekarang Tak Seperti Krisis 98|Positif
Prabowo Panggil Purbaya hingga Eks Bos BI ke Istana, Ada Apa?|Netral
Bos OJK Ungkap Ada 27 Juta Investor Pasar Modal RI, 54% Adalah Gen Z|Positif
Dolar AS Masih Cukup Kuat, Rupiah Ditutup Melemah ke Rp17.690/US$|Negatif
Buka Tabungan Emas 100 Gram di BSI, Bisa Dapat Emas Fisik!|Positif
Cara Sederhana Memahami Alasan Rupiah Melemah|Negatif
Serunya Booth LIKE IT di Jogja Financial Festival, Ramai Anak Muda|Positif
Purbaya Pastikan RI Tidak Akan Mengulangi 1998|Positif
Dorong Ekonomi Masyarakat, IFG Hadir di Jogja Financial Festival 2026|Positif
Purbaya Bilang 6 Bulan Lagi Orang Susah Berkurang, Ini Sebabnya!|Positif
BSI Pastikan Fundamental Tetap Kuat Meski Saham BRIS Koreksi|Positif
Pelajar Serius Dengar 'Kuliah Purbaya' Bahas IHSG di FinFest 2026|Positif
Fenomena Ini Jadi Alasan Jogja Financial Festival Digelar|Netral
Jogja Financial Festival: Membangun Budaya Keuangan Baru di Indonesia|Positif
Rektor UGM Tekankan Pentingnya Literasi Keuangan Bagi Anak Muda|Positif
Dibilang 'Terlalu Pede' Soal Ekonomi, Purbaya: Ini Calculated Move!|Positif
Bos LPS Ungkap Jurus Hindari Spekulasi Saat Berinvestasi|Positif
IHSG Berbalik Menguat di Akhir Sesi 1, Rebound atau Mantul Sesaat?|Positif
Bos LPS: Perkembangan Teknologi Tak Boleh Lebih Cepat Dari Literasi|Netral
BI Catat Transaksi Berjalan Defisit US$ 4 M di Q1, Terburuk Sejak 2019|Negatif
Purbaya Ungkap Strategi Ekonomi Prabowo, Gak Cuma Soal MBG|Netral
Mantap! Jogja Financial Festival 2026 Jadi Ajang Cari Kerja|Positif
Di Depan Ribuan Pelajar-Mahasiswa, Purbaya Beri Bukti Ekonomi RI Bagus|Positif
Gubernur DIY Sri Sultan Sorot Pinjol, Sebut Fenomena 'Makan Utang'|Negatif
Purbaya Curhat Jadi Menkeu Turun Berat Badan 10 Kg dalam 8 Bulan|Netral
Wah! Surat Utang Global Purbaya Diserbu Investor Asing|Positif
Purbaya: Kalau Punya Dolar AS, Jual Sekarang|Positif
Alasan Bentuk BUMN Ekspor, Purbaya: Bea Cukai Gampang Bocor|Negatif
Purbaya: Kita Akan Dorong Rupiah Rp15.000/US$ !|Positif
Purbaya: Presiden Tahu Banyak Pengusaha Mainin Harga|Negatif
Brent Tembus US$104, Pasar Cemas Konflik Timur Tengah Berlarut|Negatif
Gubernur DIY Sri Sultan Apresiasi Jogja Financial Festival 2026|Positif
Video: Nasib Bisnis Logistik Batu Bara Saat Perang & RKAB Dipangkas|Negatif
Investor Simak! Bos Danantara Ramal IHSG Bakal Membaik, Kapan?|Positif
Rektor UGM Puji Jogja Financial Festival 2026, Apresiasi LPS & CT Corp|Positif
Bos LPS: Edukasi Keuangan Tak Boleh Bersifat 'Eksklusif'!|Netral
Bos LPS: Anak Muda RI Harus Melek Digital dan Matang Finansial|Positif
BUMN Mau Konsolidasi Besar-Besaran, Nasib Karyawan?|Netral
Ketua LPS: Euforia Investasi Anak Muda Harus Diimbangi Literasi|Netral
Bos LPS Bicara Soal Paradoks Sektor Keuangan RI, Begini Penjelasannya|Netral
Antusias Pelajar Ikut Jogja Financial Festival Tinggi, Ini Buktinya|Positif
BEI Minta Insentif Pajak Emiten Diperluas, Free Float 20% Juga Dapat|Positif
Live Now! Bos LPS & Sultan HB X Buka Jogja Financial Festival 2026|Positif
Sejak Pagi, Siswa SMA Antusiasi Hadiri Jogja FinFest 2026|Positif
Purbaya Diserbu Anak Sekolah di Jogja, Ada Apa?|Positif
Video: Rupiah Lanjutkan Pelemahan & IHSG Anjlok di Level 6.000-an|Negatif
Breaking News: Dolar Kembali Tembus Rp17.700|Negatif
Siswa SMA Mau Belajar Ekonomi ke Purbaya-Anggito di FinFest 2026|Netral
Jogja Financial Festival Diserbu Anak Muda, Belajar Investasi-Keuangan|Netral
Potret Warga 'Kota Budaya' Ramai-Ramai Hadiri Jogja FinFest 2026|Netral
Breaking News! IHSG Dibuka Ambruk 2%|Negatif
Cek Rekomendasi Saham Hari Ini: Ada INDF, WIIM dan CPIN|Netral
Emiten Happy Hapsoro (RATU) Ambil 20% Hak Partisipasi di Madura Strait|Positif
Merapat Dab! Anak Muda Banjiri JEC Ikut Meriahkan Jogja FinFest 2026|Netral
Mau Buka Warung Madura? Segini Modal Usaha|Netral
Alarm Ekonomi Jepang! Inflasi Inti Anjlok, BOJ Bisa Tahan Suku Bunga|Negatif
Asia Menguat Jelang Akhir Pekan, Wall Street Cetak Rekor Baru|Positif
IHSG Longsor 3,54%, Ini 10 Saham yang Diam-Diam Diborong Asing|Positif
IHSG Anjlok Tajam, Analis Khawatir Tekanan Belum Berakhir|Negatif
Hari ke-8 IHSG Merah, Asing Ramai-Ramai Lepas Saham Ini|Negatif
Meski Jadi Bos INA, Oki & Laksono Masih Masuk Bursa Direksi BEI|Netral
Saham Syariah Mendominasi Bursa, BEI Ungkap Datanya|Positif
Eks Wakil Ketua KPK Jadi Komisaris Jasa Marga (JSMR)|Netral
Ada Emiten HSC Datangi Bursa Hari Ini|Netral
Perputaran Dana US$3,7 M/Bulan, BI Permudah Transaksi Yuan China di RI|Positif
Terungkap! Ini Deretan Insentif OJK Buat Himbara Penampung DHE SDA|Positif
DHE SDA Wajib di Himbara, BI Berikan Kemudahan Buat Eksportir|Positif
OJK Bongkar 2 Investasi Bodong Bermodus Saham dan Drama China|Negatif
Konsolidasi BUMN: 92 Perusahaan Anak Bakal Dipangkas|Netral
IHSG Ditutup Turun 3,54%, Rontok ke Level 6.000-an|Negatif
Video: Modernisasi Alkes RI, IRRA Hadirkan Teknologi Bedah Canggih|Positif
IHSG Ambles ke 6.000-an, Bos Bursa Buka Suara|Negatif
Bursa Asia Hijau, IHSG Malah Anjlok 3%, Ini Kata OJK|Negatif
Video: BUMN Ekspor Disorot, IHSG Anjlok Lebih 3% Ke Level 6.000-an|Negatif
Warning dari AS, Pasar Obligasi Masuk Zona Bahaya-Investor Waspada|Negatif
Rupiah Kembali Ditutup Melemah, Dolar AS Naik ke Rp17.640|Negatif
BI Rate Naik 50 Bps, Deretan Ekonom Ungkap Efeknya ke Rupiah & Ekonomi|Negatif
Video: Ada BUMN Ekspor, Rupiah Bisa Menguat & Emiten Bank Diuntungkan?|Positif
Video: BI Rate Naik 50 Bps Tapi IHSG Anjlok & Rupiah Lanjut Terkoreksi|Negatif
OJK: Kredit BPD Tembus Rp656 Triliun per Maret 2026|Positif
Breaking News! IHSG Anjlok 3,64%, Balik ke 6.000-an|Negatif
Prajogo Pangestu Jadi Konglomerat RI Paling Boncos Tahun Ini|Negatif
Moody's Hukum Raksasa Amerika, Peringkat Utang Jatuh ke Level Baa3|Negatif
47 Anak Usaha PTPN Mau Dipangkas|Netral
IHSG ke Level 6.100-an, Danantara-Purbaya Beri Pesan Ini ke Investor|Netral
IHSG Merah Sendirian di Asia, Saham Prajogo Babak Belur|Negatif
Minyak Naik Tipis, Pasar Masih Dibayangi Iran & Selat Hormuz|Negatif
Saham Prajogo Babak Belur! Duit Rp 1.400 T Lenyap|Negatif
Video: Rupiah Melemah-BBM Mahal, Biaya Operasional Pelayaran Melonjak|Negatif
Segini Gaji Debt Collector RI Setiap Tarik Mobil Nunggak Kredit|Netral
Video: IHSG Ambruk 2% ke 6.100 hingga Ada BUMN Khusus Ekspor Sawit Cs|Negatif
Analisis Penyebab IHSG Turun 2% Hari Ini, Sentuh Level 6.100-an|Negatif
Breaking News! IHSG Anjlok 2%|Negatif
Anak Usaha Semen Indonesia Group Dipangkas dari 40 Jadi 12|Positif
BI Rate Naik Jadi 5.25%, Nasib Rupiah Bisa Menguat ke Rp17.300|Positif
Video: Rupiah Masih Melemah di Rp 17.600 per Dolar AS|Negatif
Breaking News! IHSG Anjlok 1,43%|Negatif
Danantara Bongkar Masalah BUMN: Impairment Tembus Rp100 Triliun|Negatif
Kinerja Bank Maspion Q1 2026: Kredit Ngegas, Laba Ambles 91%|Negatif
Rupiah Dibuka Stagnan, Dolar AS Bertahan di Rp17.600|Netral
IHSG Menguat Pagi Ini, Naik 0,6%|Positif
XLSmart Buka-bukaan Soal Dividen dan Depresiasi Nyaris Rp 5 Triliun|Negatif
Kabar Baik Damai Perang AS-Iran dari Trump, Nikkei-Kospi Tebang|Positif
Rekomendasi Saham Hari Ini: PTBA, ASII hingga MYOR Layak Dicermati|Positif
Dua Buron Kasus Asuransi Masih Diburu Interpol, Ini Profilnya|Negatif
Iran Minta Google-Microsoft Cs Bayar Biaya Lewat Selat Hormuz|Negatif
Kecemasan Investor di Konflik Timur Tengah Turun, Bursa Asia Menguat|Positif
Saham Prajogo Masih Jadi Sasaran Jual Asing|Negatif
SpaceX Mau IPO Rp1.325 T, Elon MuskMau BikinRekor Dunia|Positif
Saham Ini Jadi Incaran Asing Saat IHSG Sentuh All Time Low Setahun|Positif
Daftar Sektor Penyumbang Pajak Terbesar ke Purbaya hingga April 2026|Netral
DHE Wajib Parkir di Bank BUMN, Rupiah Bisa Menguat ke Rp16.800/US$|Positif
Gelar RUPST, Bank Raya (AGRO) Sepakati Hal ini|Netral
Daftar Sektor Bisnis Ini Masih Butuh Kucuran Kredit dari Bank|Positif
BI Beri Transisi 1 Bulan Buat Bank Terapkan Aturan Batasan Beli Dolar|Netral
OJK Terbitkan Aturan Baru, Sekuritas Modal Cekak Dilarang Asal Jualan|Negatif
BI Dukung Penerbitan 'Panda & Dim Sum Bond' Purbaya, Ini Alasannya!|Positif
IHSG Lanjut Tren Koreksi, Ditutup Melemah 0,82% ke Level 6.318|Negatif
Video: BI Rate Naik 50 Bps - Ekspor Komoditas Wajib Lewat BUMN Khusus|Negatif
Perry Warjiyo: Kenaikan BI Rate 50 Bps Sudah Pertimbangkan Ekonomi RI|Netral
Bos Telkom (TLKM) Beri Kisi-Kisi Dividen Tahun Ini, Bakal Naik?|Positif
Video:OJK Sempurnakan Ketentuan RBC Perkuat Permodalan, Asuransi Siap?|Netral
BI Target Perluas QRIS Cross Border hingga ke Timor Leste di 2026|Positif
Ekspor Batu Bara Harus Lewat BUMN Khusus, Gimana Nasib Eksportir?|Negatif
BI Rate Naik Tapi Bank Masih Bisa Jaga Suku Bunga Kredit Rendah|Positif
Jumlah Investor Domestik Tembus 26,7 Juta, Mayoritas Anak Muda|Positif
Rupiah Menguat 0,54% Usai BI Rate Naik, Dolar AS Turun ke Rp17.600|Positif
Transaksi Digital Masih Tumbuh Tinggi, QRIS Meroket 108% di April|Positif
BI: Hasil Stress Test Perbankan RI 'Tetap Kuat' di Mei 2026|Positif
Video: BI Rate Naik 50%, Rupiah Menguat ke Rp 17.600 per USD|Positif
Breaking, IHSG Terkoreksi 0,8% Usai BI Putuskan Kerek Suku Bunga|Negatif
Breaking News: BI Rate Naik, Rupiah Menguat ke Rp17.600/US$|Positif
BI Rate Diputuskan Naik 50 Bps Jadi 5,25%, Ini Alasannya!|Negatif
Video: Mengejutkan! BI Naikkan Suku Bunga Acuan 50 Bps Jadi 5,25%|Negatif
Breaking News! BI Rate Naik Jadi 5,25% di Mei 2026|Negatif
BI Gencar Terbitkan SRBI, Kini Rp 921,88 T Demi Selamatkan Rupiah|Positif
Dolar AS Sudah Rp17.600, BI Yakin Rupiah Bakal Segera Menguat!|Positif
Bos BI Warning Inflasi RI Bakal Naik, Ini Pemicunya!|Negatif
Deretan Tas Mewah Milik Sandra Dewi Dilelang Kejagung, Segini Harganya|Netral
Dunia Amburadul, Aliran Modal Asing Keluar RI US$ 800 Juta|Negatif
Bos BI Ungkap Kebijakan Moneter Global 'Ketat', Ini Sebabnya|Negatif
Bos BI Ramal Ekonomi Global Cuma Tumbuh 3%, Inflasi Dunia Tembus 4,3%|Negatif
Bos BEI Pede IHSG Cerah Usai Pidato Prabowo|Positif
Purbaya: BUMN Ekspor Kabar Positif Buat Pasar Saham, Saatnya Serok|Positif
Video: IHSG & Rupiah Masih Dalam Tekanan, Duit Investor Lari Ke Mana?|Negatif
IHSG Masih Bearish, Sesi I Terkoreksi 0,6% ke Level 6.332|Negatif
Gandeng Syailendra Capital, BRI Perkuat Layanan Wealth Management|Positif
Gelar RUPS, Pemegang Saham PTPP Sepakati Agenda Ini!|Netral
Calon Bos BEI Iding Pardi Optimistis, Usung Penguatan Tata Kelola|Positif
Rakyat Melarat, Raja RI Terkaya Ini Bagi-bagi Uang Rp 20 Miliar|Negatif
Meski Hormuz Masih Membara, Harga Minyak Turun Lagi|Positif
Breaking! Sempat Naik Tinggi, IHSG Kembali Longsor Nyaris 2%|Negatif
Rupiah Terpuruk, Bank Ini Sudah Jual Dolar Rp18.000|Negatif
Sharif Cicip & Ilham Habibie Jadi Komisaris VKTR, Ardi Bakrie Dirut|Positif
Harga Turun Tajam, BEI Gembok Saham SHIP|Negatif
Prabowo Subianto Pidato di DPR, Rupiah Menguat ke Rp17.710/ US$|Positif
Breaking News! Jelang Pidato Prabowo, IHSG Balik Arah dan Melesat 1%|Positif
Manuver Purbaya Borong SBN Rp 2,2 T Demi Rupiah|Positif
Tensi Geopolitik Timur Tengah Kembali Memanas, Bursa Asia Merah|Negatif
Breaking! IHSG Dibuka Anjlok 1,35% Jelang Keputusan Suku Bunga BI|Negatif
Breaking News! Jelang Pengumuman BI-Rate, Dolar Tembus Rp17.730|Negatif
Ada Emiten Prajogo Pangestu & Haji Isam, BEI Pantau Ketat 5 Saham Ini|Negatif
IHSG Masih Tertekan, Ini Rekomendasi Saham yang Menarik Buat Dilirik|Netral
Dasco Beri Kode Soal Pasar Saham RI: Lihat Setelah 29 Mei!|Netral
Asing Serok Saham-Saham Tambang Saat IHSG Ambruk ke Level Terendah|Positif
Purbaya Vs Analisa S&P Soal Utang RI|Netral
Perusahaan Taipan RI Akusisi Tambang Batubara Australia US$3,9 Miliar|Positif
IHSG Ambruk ke Level Terendah, Asing Kompak Lego 10 Saham Ini|Negatif
Cerita Bursa Raksasa Tetangga RI Mau Kolaps, Diselamatkan Investor Ini|Negatif
LPS Siap Jamin Polis Asuransi, Tapi Tak Semua Perusahaan Dapat|Netral
RUPST Semen Baturaja (SMBR) Sepakat Angkat Dua Komisaris Baru|Netral
Jurus Purbaya Tunjukkan Hasil, Investor Bawa Dolar AS ke RI|Positif
KUR Bank Mandiri Tembus Rp14,54 Triliun hingga April 2026|Positif
Oki Ramadhana Jadi CEO INA, Ini Susunan Dewan Direktur Terbaru|Netral
Didorong Emas, Pembiayaan Konsumer Bank Mega Syariah Tumbuh 23%|Positif
IHSG Jebol ke 6.300! Potret Saham RI Rontok Berjamaah|Negatif
IHSG Ditutup Turun 3,46%, Parkir di Level Terendah Setahun Terakhir|Negatif
LPS Targetkan Aset Tahun 2026 Naik Jadi Rp 303,5 Triliun|Positif
Belum Rilis Rekap Dividen, Bos Danantara: Sabar, Kita Bersih-bersih|Netral
Oil Sulit Balik ke US$60, Ashmore Asset Management Tekankan Hal Ini!|Negatif
Video:INDY Terbitkan Surat Utang, Kembangkan Portofolio Bisnis Tambang|Positif
LPS Siap Bangun Kantor Sendiri, Dua Tahun Lagi Rampung|Positif
Rupiah Masih Loyo, Dolar AS Ditutup Naik ke Rp17.695|Negatif
Video: IPO Semester I Masih Sepi, BEI Yakin Target 2026 Tercapai|Netral
Video:Oki Ramadhana Resmi Ditunjuk Sebagai Ketua Dewan Direktur INA|Positif
Video: Momen Sidak Dasco, Bos OJK & Danantara ke Bursa Efek|Netral
21 Emiten Big Cap Ambruk 10% Lebih Hari ini, Mayoritas Saham Konglo|Negatif
Breaking! IHSG Ambruk 4,11%, Terjun Bebas ke Level Terendah Setahun|Negatif
Ada Perusahaan Entertainment Jumbo Mau IPO, Diduga Milik Raffi Ahmad|Positif
Penampakan Ferrari Hingga Rolls-Royce Sandra Dewi Dilelang Kejagung|Netral
Pantau 1.500 Lebih Bank, LPS Siapkan Sistem Ini|Netral
Video Bos BI Ditugaskan Menkeu Buka Bantuan Pemerintah: Hoaks!|Netral
Dasco Datangi Kantor Bank Indonesia Siang Ini, Ada Agenda Apa?|Netral
Hasil Korupsi, Ini Penampakan Kursi Firaun yang Dilelang Kejagung|Netral
IHSG Sesi 1 Ditutup Turun 3%, Bukan Cuma Gara-Gara Saham MSCI|Negatif
Pernyataan Lengkap Bos OJK di Bursa Efek Indonesia Siang Ini|Netral
DPR Tanya BI Rupiah Tak Pernah Capai Target, Ini Penjelasan Perry|Negatif
Penampakan Dasco, Bos OJK dan Danantara Sidak ke BEI|Netral
Bos OJK Sebut Penurunan IHSG Masih Moderat|Netral
Pernyataan Lengkap Dasco di Bursa Efek Indonesia Siang Ini|Netral
Breaking News! IHSG Ambruk 3% Lebih, Turun ke Level 6.300-an|Negatif
CEO Danantara Buka Suara IHSG Anjlok Terus, Ungkap Potensi Ini|Positif
BI Tegaskan Cadangan Devisa RI Kuat, Sesuai Standar IMF!|Positif
Penyebab IHSG Tiba-Tiba Anjlok 2% Siang Ini|Negatif
Mendadak Kunjungi BEI, Dasco Bilang Begini ke Bos OJK dan BEI|Netral
Video: Rupiah Ambruk Tembus Rp 17.700 per USD - AS Batal Serang Iran|Negatif
Breaking! Dasco Mendadak Kunjungi BEI, Didampingi Bos OJK & Danantara|Netral
Dirut Mandiri Sekuritas Oki Ramadhana Ditunjuk Jadi CEO INA|Positif
Trump Tunda Serangan ke Iran, Harga Minyak Turun ke US$110|Positif
INDY Terbitkan Surat Utang US$ 100 Juta, Duitnya Buat Tambang Emas|Positif
Jangan Panik Dolar Rp17.700, DPR-Pemerintah Cari Solusi Buat Rupiah|Netral
Emiten Ini Ubah Haluan Bisnis dan Caplok Dua Perusahaan Singapura|Positif
Video: Rupiah Tembus Rp 17.650/USD, Suku Bunga BI Ditahan Atau Naik?|Negatif
Breaking News! Dolar AS Tembus Rp17.700|Negatif
Trump Bakal Lantik Bos Baru The Fed, Terkaya Sepanjang Sejarah AS|Netral
Video: Tekanan Jual Masih Tinggi, IHSG & Rupiah Lanjut Dibuka Melemah|Negatif
Breaking News! Dolar AS Bertahan di Rp17.650|Negatif
Kejutan dari Jepang! Ekonomi Tumbuh 2,1%, Lampaui Ekspektasi|Positif
IHSG Masih Tertekan, Melemah 0,53% di Awal Perdagangan Sesi I|Negatif
Purbaya Sediakan Rp2 T/Hari Buat Stabilkan Rupiah, Uangnya dari Mana?|Netral
IHSG Masih Tertekan, Deretan Saham Ini Menarik Buat Dilirik|Positif
Bursa Asia Mayoritas Menguat Respons Penurunan Harga Minyak|Positif
Usai Rapat 2 Jam dengan Prabowo, Bos BI soal Rupiah: Yakin Stabil!|Positif
Asing Kompak Lego 10 Saham Ini Kala IHSG Merah Merona|Negatif
Geger Emas 1 Ton Milik Penguasa Toba Hilang Diangkut 17 Kuda|Negatif
Asing Serok Saham-Saham Ini Saat IHSG Makin Ambruk|Positif
Purbaya Tegaskan Kondisi RI Beda dengan Krisis Moneter 98|Positif
Prabowo Tanya Kondisi Ekonomi RI, Purbaya: Bagus, Enggak Ada Masalah|Positif
Kucurkan Rp2 T Tiap Hari Bantu Jaga Rupiah, Ini Sumber Dana Purbaya|Netral
Purbaya Guyur Rp2 T Tiap Hari Bantu BI Selamatkan Rupiah|Netral
IHSG Berdarah-Darah, BEI Sebut Tekanan Datang dari Berbagai Penjuru|Negatif
Jelang Semester I IPO Masih Sepi, BEI Optimis Masih Sesuai Target|Positif
"Soal ""Desa Tak Pakai Dolar"", DPR Minta Warga Jangan Salah Arti"|Netral
IHSG Sempat Ambruk 4% Lebih, Asing Net Sell Rp 464 Miliar|Negatif
Dony Oskaria Kumpulkan Bos Telkom & Telkomsel, Ini yang Dibahas|Netral
BEI Terima Audiensi Emiten-emiten yang Masuk Daftar HSC, Ini Daftarnya|Netral
XPeng Akuisisi 90,1% Saham Pabrik Kendaraan Listrik Grup Erajaya|Positif
Dilema BI Belajar dari Krisis 98, Rupiah Aman Tapi Likuiditas Kering|Negatif
HMSP Pertahankan Kepemimpinan di Tengah Tantangan Industri Tembakau|Positif
Video: Jurus RI Jaga Mesin Pendapatan Negara Sektor Tambang Era Perang|Netral
Bos BEI Buka Suara Usai IHSG Anjlok Sampai 4% Hari Ini|Negatif
Video: Gak Cuma Efek Perang, Rupiah Anjlok Juga Terkait Kredibilitas|Negatif
Purbaya Jelaskan Maksud Prabowo 'Orang Desa Tak Pakai Dolar'|Netral
Video: Ekonom: Krisis Kepercayaan Pasar RI Sangat Serius, IHSG Anjlok|Negatif
Video: DPR Kritik Rupiah Melemah - Purbaya: RI Jauh Dari Krisis 1998|Netral
Tok! DPR RI dan BI Sepakat Optimalkan Penguatan Rupiah|Positif
Rupiah Melemah & Dana Asing Keluar, Bos BI Blak-blakan Penyebabnya|Negatif
Gubernur BI Sebut Nilai Tukar Rupiah Akhir Tahun Bisa Rp 16.500/US$|Negatif
Kinerja IHSG Sepanjang Tahun Berjalan Ternyata Terburuk di Dunia|Negatif
IHSG Pangkas Koreksi, Ditutup Turun 1,85% Hari Ini|Negatif
Bos BI Ungkap Besarnya Dana Asing Keluar dari RI, Jumlahnya Segini|Negatif
OJK Kasih Sinyal Bank Mini yang Perlu Merger|Netral
Luhut Kumpulkan Petinggi OJK, Bahas Reformasi Pasar Modal-Nasib Rupiah|Netral
Luhut Bocorkan Pesan MSCI ke Bos OJK, Ini Isinya|Netral
Dolar Rp17.600, Bos BI: Jangan Kami Dinilai Ingin Menaikkan Penerimaan|Negatif
Analis Ungkap Alasan IHSG Anjlok 4%, Investor Wajib Pantau Hal Ini|Negatif
Stabilkan Rupiah, BI Sudah Pakai Cadangan Devisa US$ 10 Miliar|Negatif
Luhut Bertemu Bos OJK, Bahas Dampak MSCI Hingga Kredit Macet BPR|Netral
Bos BI Pede Rupiah Perkasa Lagi Juli-Agustus 2026, Ini Alasannya!|Positif
Nilai Tukar Rupiah Terendah Sepanjang Masa, Dolar AS Kini Rp17.640|Negatif
DPR Ingatkan Bos BI: Zaman Pak Habibie Rupiah Pernah Balik ke Rp6.000|Negatif
Komisi XI DPR Minta BI Balikkan Dolar AS ke Level Rp16.000|Negatif
Momen Anggota DPR Cecar BI Soal Dolar Tembus Rp 17.600|Negatif
Bos BI Ramal Dolar Balik ke Rp16.200-16.800 Akhir 2026|Positif
Pemegang Dolar Siap-siap! Bos BI: Juli-Agustus Rupiah Bakal Menguat|Positif
Dolar Rp 17.600/US$, Gubernur BI: Rupiah Masih Stabil|Netral
Tanpa Sokongan MSCI & FTSE, Saham Prajogo Tumbang Berjamaah di 2026|Negatif
Video: Diterjang Aksi Jual, IHSG Sempat Koreksi Lebih Dari 4,6%|Negatif
Belasan Tahun Mau Go Private, SCPI Kembali Tender Offer Buat Delisting|Negatif
Dolar AS Sudah Kini Rp 17.630, Bisa Tembus Rp18.000?|Negatif
Video: Rupiah Terlemah Sepanjang Masa, DPR Panggil Dewan Gubernur BI|Negatif
Terungkap! 2 Negara Adidaya Ini Pemberi Utang Utama RI di Q1-2026|Netral
IHSG Tembus Ke Level 6.400, Purbaya: Waktunya Serok Bawah|Positif
Rupiah Loyo, Ada Bank Sudah Jual Dolar Rp 17.800|Negatif
IHSG Sesi 1 Ambruk 3,76%, Duit Rp 482 Triliun Menguap|Negatif
Video: Rupiah Melemah Parah, Begini Proyeksi Dolar AS Ke Depan|Negatif
Dividen sampai Musim Haji Alasan Dolar AS Capai Rp17.630|Negatif
AS - Iran Panas Lagi, Harga Minyak Melonjak ke US$111|Positif
BI: Utang Luar Negeri RI Tembus Rp 7.627 Triliun di Akhir Kuartal I|Negatif
Video: PLTN UEA Diserang, Harga Minyak Mendidih & Harga Emas Ambruk 4%|Negatif
IHSG & Rupiah Sama-sama Anjlok, Begini Kata Purbaya!|Negatif
Video: Dihantam Banyak Sentimen, Rupiah & IHSG Awali Pekan Yang Berat|Negatif
Video: Sentimen MSCI - FTSE Bikin IHSG Ambruk Lebih Dari 4%|Negatif
Breaking! Nilai Rupiah Turun 1,15%, Dolar AS Bertengger di Rp17.660|Negatif
Susunan Terbaru Direksi dan Komisaris Garuda Indonesia (GIAA)|Netral
Breaking News! Efek MSCI Makin Terasa, IHSG Anjlok 4,31%|Negatif
Video: IHSG Terus Anjlok & Melemah Hingga 3,6% ke 6.400-an|Negatif
Breaking! IHSG Anjlok 3,61%, Ada Panic Selling Gegara MSCI-FTSE|Negatif
Telkom (TLKM) Umumkan RUPS 8 Juni 2026, Mau Bahas Hal Penting Ini|Netral
IHSG Tiba-tiba Dibuka Anjlok 2,59%, Ini Penyebabnya|Negatif
Video: Dolar AS Makin Perkasa Lawan Rupiah, Tembus Rp 17.600|Negatif
Video: IHSG Anjlok Lebih Dari 2%, Sentuh Level 6.500-an|Negatif
Breaking News! Dolar AS Tembus Rp17.630|Negatif
Breaking! Efek MSCI-FTSE Masih Lanjut, IHSG Dibuka Ambruk 2,59%|Negatif
Intip 5 Rekomendasi Saham yang Potensi Kasih Cuan Hari Ini|Positif
10 Saham Ini Diserok Asing Kala IHSG Babak Belur Imbas MSCI|Positif
Konflik Timur Tengah Memanas, Bursa Asia Kompak Jebol|Negatif
Asing Kompak Lego 10 Saham Ini Sebelum Libur Panjang Pekan Lalu|Negatif
OJK Respons Rencana Prabowo Turunkan Bunga KUR Jadi 5%|Netral
Prabowo Ungkap Danantara Kelola Aset US$ 1.000 M, Terbesar Ke-6 Dunia!|Positif
Prabowo Cerita Kepala BPKP Izin Periksa Penyelewengan Orang Dekatnya|Netral
Raja Ritel RI Tiba-Tiba Tumbang, Keluarga Riady Ambil Alih|Negatif
Jurus Habibie Sukses Turunkan Dolar dari Rp 16.000 ke Rp 6.550|Positif
Warga AS Menyesal Soal Tabungan, Kok Bisa?|Negatif
Video: Ekonom Ungkap Nasib Rupiah Jika Perang Sampai Akhir Tahun 2026|Negatif
Canda Prabowo Soal Dolar, Sebut Purbaya hingga Titiek Soeharto|Netral
Digitalisasi Masif! OJK Buka-bukaan Nasib Karyawan Bank|Netral
Video; Dihantam Isu MSCI & Perang, Saham Sektor Mana Yang Bisa Cuan?|Negatif
Kisah Rakesh Jhunjhunwala, Sukses Ubah Rp975 Ribu Jadi Rp94 Triliun|Positif
Dosen Matematika Jadi Kaya Raya Usai Praktekan Ilmunya di Investasi|Positif
Saldo Minimum Bank Mandiri, BRI, BNI Terbaru, Berlaku 17 Mei 2026|Netral
Benarkah Tuyul Tak Bisa Curi Uang di Bank? Ini Penjelasannya|Netral
Mulanya Jualan Kembang Api, Sosok Ini Sekarang Jadi Raja Rokok RI|Positif
Dulu Calo Tiket di Bandara, Sosok Ini Sekarang Pemilik Lion Air|Positif
Ada Peran Kakek Prabowo di Balik Berdirinya Bank Pertama di RI|Netral
Penawar Misterius Bayar Rp158 M Buat Makan Malam Bareng Warren Buffett|Positif
Prabowo Resmikan 1.061 Kopdes Merah Putih di Jawa Timur|Positif
Video: Salurkan Gas ke Pelosok, Bisnis Perkapalan Perlu Kontrak Pasti|Netral
Bakal Kena Pajak Rp129 T, Taipan Ini Beri Jawaban Tak Terduga|Negatif
