Teks_Gabungan|Label_Sentimen
Deretan Saham Incaran Asing. Asing mencetak transaksi beli bersih (net buy), saat IHSG, Rabu (13/5/2026), ditutup melemah. Saham TINS, PACK dan TLKM diborong asing.|Positif
Harga Emas Antam (ANTM), UBS, dan Galeri 24 di Pegadaian, Kamis 14 Mei 2026. Harga emas Antam (ANTM), UBS, dan Galeri 24 di Pegadaian hari ini, Kamis (14/5/2025). Cek update lengkapnya|Netral
Cengkeraman Baru Haji Isam di Bursa. Haji Isam memborong 6,83 miliar saham emiten tambang dan perdagangan nikel PT Abadi Nusantara Hijau Investama Tbk (PACK).|Positif
Kinerja Moncer, Bank INA (BINA) Optimistis Tapi Tetap Prudent. Bank INA mencatatkan kinerja positif pada kuartal I-2026.|Positif
OJK Klaim Pasar Terkendali Usai Rebalancing MSCI, Tidak Ada Panic Selling. Otoritas Jasa Keuangan (OJK) memastikan pasar modal RI tetap terkendali setelah pengumuman rebalancing indeks global oleh MSCI.|Positif
Harga Minyak Turun, OPEC Pangkas Proyeksi Permintaan Global. Harga minyak turun setelah OPEC pangkas proyeksi permintaan global dan pasar mewaspadai krisis Selat Hormuz|Negatif
Harga Emas Naik, Pasar Deg-Degan Tunggu Trump dan Xi. Harga emas hari ini naik tipis di tengah pelemahan dolar AS dan fokus pasar pada pertemuan Trump-Xi Jinping di Beijing|Positif
IHSG Ambles, Market Cap BEI Hilang Rp 581 Triliun. Indeks harga saham gabungan (IHSG) selama sepekan turun 3,53% sehingga ditutup pada level 6.723,3.|Negatif
Usai Rebalancing MSCI, BEI Perkuat Reformasi Pasar Modal. BEI menegaskan fokus reformasi dan transparansi pasar modal usai rebalancing MSCI di tengah volatilitas global.|Positif
Harga Perak Antam (ANTM) Hari Ini, Kamis 14 Mei 2026: Melejit. Harga perak Antam (ANTM) hari ini pada Kamis (14/5/2026) terpantau melejit. Harga perak Antam melaju ke level ini|Positif
Harga Emas Antam (ANTM) Hari Ini, Kamis 14 Mei 2026: Solid. Harga emas Antam (ANTM) terpantau solid pada Kamis (14/5/2026). Cek juga harga beli kembali (buyback) emas Antam|Positif
World Gold Council Sebut Emas Jadi Aset Strategis RI. World Gold Council menyebut emas jadi aset strategis RI di tengah inflasi, krisis global, dan tekanan pasar saham|Positif
Pasar Saham Asia Pasifik Bergerak Liar, Fokus Pertemuan Trump dan Xi Jinping. Pasar saham Asia-Pasifik bergerak variatif jelang pertemuan Trump-Xi Jinping, sementara Wall Street kembali cetak rekor|Netral
Harga Emas Perhiasan Hari Ini, Kamis 14 Mei 2026, Cek Rinciannya. Harga emas perhiasan hari ini, Kamis (14/5/2026) di Raja Emas Indonesia, Hartadinata Abadi, dan Laku Emas dalam berbagai karat|Netral
Harga Bitcoin (BTC) Jatuh Tajam, Aksi Short Whale Bikin Pasar Gemetar. Harga Bitcoin (BTC) jatuh tajam usai aksi short whale Rp1,1 triliun mengguncang pasar kripto global|Negatif
Harga CPO Tersungkur ke Level Terendah 2 Bulan. Harga CPO di Bursa Malaysia Derivatives jatuh ke level terendah dua bulan akibat melemahnya permintaan India dan China.|Negatif
Heboh Diskon Harga Emas. Diskon harga emas di India tembus rekor US$ 200 per ons usai kenaikan tarif impor picu aksi jual investor|Negatif
BERITA POPULER: Drama Pengumuman MSCI hingga Harga Emas Antam (ANTM) Rontok. Berita populer dalam 24 jam terakhir, mulai dari drama pengumuman MSCI hingga harga Emas Antam (ANTM) rontok|Negatif
Harga Minyak Ambles, Pasar Tunggu Pertemuan Trump dan Xi Jinping. Harga minyak dunia ambles akibat kekhawatiran suku bunga AS, inflasi, dan pasar menanti pertemuan TrumpXi Jinping|Negatif
Wall Street Cetak Rekor! Saham AI Jadi Motor Utama. Wall Street mayoritas cetak rekor ATH baru didorong saham AI, meski inflasi AS naik dan ekspektasi suku bunga The Fed tetap tinggi|Positif
Harga Emas Melemah Dua Hari Beruntun, Harapan The Fed Buyar. Harga emas melemah dua hari beruntun akibat inflasi AS, perang Iran, dan memudarnya harapan pemangkasan suku bunga|Negatif
Mitra10 (CSAP) Terus Ekspansi. PT Catur Mitra Sejati Sentosa atau Mitra10, anak usaha PT Catur Sentosa Adiprana Tbk (CSAP), terus ekspansi dengan membuka toko baru.|Positif
Geger MSCI, Investor Lokal Mesti Apa?. Geger MSCI kembali mengguncang pasar saham Indonesia, menyusul hasil MSCI rebalancing Mei 2026. Lantas, investor lokal mesti apa?|Netral
3 Saham Diberondong Aksi Jual Asing, Net Sell Menggunung Lagi. Investor asing agresif jual bersih (net sell) dengan nilai besar pada Rabu (13/5/2026). Saham BBRI, BMRI, AMMN paling banyak dijual asing.|Negatif
Geger MSCI, Dana Asing Bisa Bergeser ke Saham Ini. Geger MSCI berpotensi mendorong rotasi likuiditas investor asing ke saham-saham, seperti BBCA, BMRI, BBNI, dan TLKM.|Positif
Nasib Rupiah Pekan Depan Bakal Begini. Pada perdagangan Rabu (13/5), rupiah ditutup menguat 53 poin terhadap dolar AS setelah sebelumnya sempat menguat di Rp 17.475.|Positif
Prediksi Harga Emas Antam (ANTM) Kamis 14 Mei 2026. Harga emas Antam (ANTM) diperkirakan bergerak fluktuatif pada Kamis,14 Mei 2026. Harga emas Antam diprediksi naik ke level ini.|Positif
Prediksi IHSG dan Rekomendasi Saham Senin, 18 Mei 2026. Indeks harga saham gabungan (IHSG) diprediksi akan melanjutkan pelemahan pada perdagangan, Senin (18/5/2026).|Negatif
Plaza Indonesia (PLIN) Bagi Dividen Tunai, Cek Jadwalnya. PT Plaza Indonesia Realty Tbk (PLIN) akan membagikan dividen tunai sebesar Rp 279,3 miliar dari laba bersih tahun buku 2025.|Positif
IHSG Anjlok, tapi Saham-saham Ini Menanjak. Indeks harga saham gabungan (IHSG) hari ini, Rabu (13/5/2026), ditutup melemah 135,5 poin (1,98%) ke level 6.723,3.|Negatif
OJK Ungkap Penyebab MSCI Depak 18 Saham RI. Indeks global MSCI mengeluarkan 18 saham Indonesia dalam pengumuman hasil peninjauan indeks periode Mei 2026 pada Rabu (13/5).|Negatif
Penopang Kinerja ITMG saat Harga Batu Bara Bergejolak. PT Indo Tambangraya Megah Tbk (ITMG) mengumumkan rapor kinerja 1Q26 di tengah gejolak harga komoditas batu bara. Bagaimana nasib labanya?|Netral
Rupiah Balik Arah Usai Digempur Tekanan. Pada perdagangan Rabu (13/5), rupiah ditutup menguat 53 poin terhadap dolar AS setelah sebelumnya sempat menguat di Rp 17.475.|Positif
20 Saham Small Cap Pilihan 2026, Bisa Cuan hingga 93%. RHB menetapkan 20 saham small cap pilihan tahun 2026, dengan potensi cuan besar.|Positif
Kembalikan Kepercayaan Pasar. Kekhawatiran pasar saat ini tidak hanya penurunan indeks jangka pendek, tetapi munculnya risk premium yang lebih tinggi terhadap Indonesia.|Negatif
Sentimen MSCI Bikin IHSG Turun Nyaris 2%, OJK Sebut Masih Batas Wajar. OJK menyampaikan penurunan IHSG yang hampir 2% pada Rabu (13/5/2026) imbas tertekan karena rebalancing MSCI, masih dalam batas wajar.|Negatif
OJK Pede Pasar Modal RI Punya Peluang ke Level Lebih Tinggi dari Emerging Market. OJK menegaskan Indonesia tidak hanya ingin bertahan di level emerging market, tetapi memiliki ambisi ke klasifikasi pasar yang lebih tinggi.|Positif
Harga Emas Hari Ini, Rabu 13 Mei 2026, di BSI, HRTA, Lotus Archi & Minigold. Simak harga emas di BSI, HRTA (Emasku & EmasKita), Lotus Archi, dan Minigold pada hari ini, Rabu 13 Mei 2026|Netral
Saham BBRI Dihantam Badai. Asing bermanuver dengan melakukan aksi jual di saham PT Bank Rakyat Indonesia (Persero) Tbk (BBRI).|Negatif
Sentimen MSCI dan Inflasi AS Jadi Biang Kerok IHSG Rontok. IHSG hari ini anjlok dipicu inflasi AS, rebalancing MSCI, dan pelemahan rupiah, Pilarmas rekomendasikan saham RAJA untuk sesi II|Negatif
IHSG Minus setelah Pengumuman MSCI, Ini Kata OJK. OJK menilai kondisi tersebut menunjukkan belum adanya aksi panic selling di pasar saham domestik.|Netral
IHSG Tumbang, Cuan 5 Saham Malah Ngegas. IHSG hari ini tumbang 1,81%. Cuan lima saham malah ngegas dan masuk daftar top gainers, bahkan ada yang mentok ARA|Positif
Harga Emas Perhiasan Hari Ini, Rabu 13 Mei 2026, Cek Update-nya. Harga emas perhiasan hari ini, Rabu (13/5/2026) di Hartadinata Abadi, Raja Emas Indonesia, dan Laku Emas berbagai karat. Berikut updatenya|Netral
GULA Balikkan Rugi Jadi Laba di Kuartal I-2026. PT Aman Agrindo Tbk (GULA) berhasil membalikkan keadaan rugi menjadi laba, dengan membukukan laba bersih Rp 36,8 juta pada kuartal I-2026.|Positif
Ahli Ungkap Tren Harga Emas Sesungguhnya. Harga emas diperkirakan akan tetap berfluktuasi dalam kisaran US$ 4.6904.845.|Netral
Lembaga Kliring Dinilai Memiliki Peran Penting dalam Perlindungan Masyarakat. Fungsi ICH khususnya dalam perdagangan berjangka komoditi dan derivatif adalah menjaga transparansi dan integritas pasar.|Positif
SMGR Bagi Dividen 100% Laba, Cek Jadwalnya. PT Semen Indonesia (Persero) Tbk (SMGR) akan membagikan dividen tunai sebesar Rp 190,8 miliar untuk tahun buku 2025.|Positif
Saham RAJA Ngacir, Ada Aksi Ini. Emiten Happy Hapsoro, PT Rukun Raharja Tbk (RAJA) berencana melakukan pemecahan nilai nominal saham (stock split) dengan rasio 1:5.|Positif
Waspada, Harga Emas Terkoreksi Lebih Dalam ke Level Ini. Harga emas diprediksi lanjut terkoreksi ke US$ 4.637 dipicu penguatan dolar AS dan ekspektasi suku bunga tinggi The Fed|Negatif
DSSA & BREN Bisa Kena Outflow Segini Gara-gara MSCI. Saham Dian Swastatika Sentosa (DSSA) dan Barito Renewables Energy (BREN) jadi pusat tekanan terbesar dari hasil MSCI rebalancing Mei 2026.|Negatif
XL Smart (EXCL) Petik Hasil Merger. PT XL Smart Telecom Sejahtera Tbk (EXCL) mulai memetik hasil sinergi dari penggabungan usaha (merger). Bagaimana dampaknya terhadap kinerja?|Positif
Emiten Prajogo Pangestu (CDIA) Tebar Dividen Tunai, Segini Nilainya. Emiten milik konglomerat Prajogo Pangestu, PT Chandra Daya Investasi Tbk (CDIA) akan membagikan dividen tunai tahun buku 2025.|Positif
Harga Emas Antam (ANTM), UBS, dan Galeri 24 di Pegadaian, Rabu 13 Mei 2026. Harga emas Antam (ANTM), UBS, dan Galeri 24 di Pegadaian hari ini, Rabu (13/5/2025). Cek update lengkapnya|Netral
KEEN Menang Tender PLTA Pakkat 2 dari PLN, Kapasitas 45 MW. Kencana Energi Lestari Tbk (KEEN) kembali mencatatkan langkah strategis dalam pengembangan EBT.|Positif
Saham-Saham Anti Boncos, Ada yang Mentok ARA. Sejumlah saham anti boncos dan masuk daftar top gainers saat IHSG hari ini anjlok pada sejam perdagangan, ada yang mentok ARA|Positif
Saham BBRI Berbalik Arah, Ini Pemicunya. Saham Bank Rakyat Indonesia (BBRI) berbalik merah pada sesi I 13 Mei.|Negatif
Harga Emas Lesu Jelang Pertemuan Trump dan Xi Jinping. Harga emas hari ini lesu jelang pertemuan Trump-Xi Jinping, pasar juga mencermati inflasi AS dan arah suku bunga The Fed|Netral
Saham Melejit 139% Disuspensi BEI. Bursa Efek Indonesia (BEI) melakukan suspensi atau penghentian sementara terhadap satu saham, mulai sesi I perdagangan, Rabu (13/5/2026).|Negatif
Google Ungkap IPOT Unggul di Proteksi Keamanan Digital. Google menyoroti IPOT sebagai sekuritas dengan proteksi keamanan digital dan anti-phishing yang kuat di Indonesia|Positif
Siap-siap Pengumuman MSCI yang Lebih Krusial. Yang perlu dicermati ke depan adalah MSCI Market Accessibility Review pada Juni 2026 sebagai katalis yang lebih substansial.|Netral
18 Saham RI Dicoret dari MSCI, Net Sell Asing Nyaris Rp 50 Triliun. MSCI resmi mengumumkan hasil tinjauan indeks global edisi Mei 2026. Sejumlah saham dicoret, ada pula yang diturunkan. Bagaimana dampaknya?|Negatif
Nilai Tukar Rupiah Hari Ini, Rabu 13 Mei 2026: Terbentur Tekanan. Nilai tukar (kurs) rupiah hari ini pada Rabu (13/5/2026) terpantau terus merosot. Rupiah melemah ke level ini.|Negatif
IHSG Longsor, 5 Saham Justru Melonjak Tajam. IHSG hari ini dibuka longsor 1,38%. 5 saham justru melonjak tajam dan masuk daftar top gainers, bahkan ada yang ARA|Positif
Saham Menukik 47% Masuk UMA. Bursa Efek Indonesia (BEI) memantau pergerakan Unusual Market Activity (UMA) terhadap satu saham emiten, pada Rabu (13/5/2026).|Negatif
Harga Perak Antam (ANTM) Hari Ini, Rabu 13 Mei 2026: Lompat Tinggi. Harga perak Antam (ANTM) hari ini pada Rabu (13/5/2026) terpantau naik tinggi. Harga perak Antam melaju ke level ini.|Positif
Brigit Biofarmaka (OBAT) Tebar Dividen Rp 5,1 Miliar di Tengah Ekspansi Agresif. Brigit Biofarmaka Teknologi (OBAT) membagikan dividen Rp5,1 miliar di tengah ekspansi agresif bisnis herbal, suplemen, dan kosmetik nasional|Positif
Asing Kabur, Saham Ini Dihajar Habis-habisan. Asing mencetak transaksi jual bersih (net sell), saat IHSG, Selasa (12/5/2026), ditutup melemah. Saham ANTM, BMRI dan CUAN dilepas asing.|Negatif
Harga Emas Antam (ANTM) Hari Ini, Rabu 13 Mei 2026: Anjlok Tajam. Harga emas Antam (ANTM) terpantau anjlok tajam pada Rabu (13/5/2026). Cek juga harga beli kembali (buyback) emas Antam|Negatif
IHSG Bakal Tertekan Rebalancing MSCI, tapi 3 Saham Dijagokan. Indeks harga saham gabungan (IHSG) diprediksi akan melanjutkan pelemahan pada perdagangan, Rabu (13/5/2026).|Negatif
AMMN, TPIA, CUAN, AMRT Keluar dari Indeks MSCI Global Standard, Kok Bisa?. Sejumlah saham non-HSC dikeluarkan MSCI dari indeks global standard.|Negatif
Saham Pilihan untuk Trading 13 Mei dan Target Harganya. IHSG bakal melemah, rekomendasi saham pilihan ISAT, MEDC, BUMI hingga BBCA untuk trading hari ini dengan target harganya|Positif
Saham-saham Ini Jadi Incaran Asing. Asing mencetak transaksi beli bersih (net buy), saat IHSG, Selasa (12/5/2026), ditutup melemah. Saham ADRO, TINS dan TLKM diborong asing.|Positif
Saham CDIA Mulai Dilahap Lagi, Harga Bisa Segini. Saham Chandra Daya Investasi (CDIA) kembali mencetak net buy asing.|Positif
IHSG Berpotensi Koreksi Lanjutan, tapi 6 Saham Siap Cuan. Indeks harga saham gabungan (IHSG) diprediksi akan melanjutkan pelemahan pada perdagangan, Rabu (13/5/2026).|Positif
Ramalan Nasib Saham BRPT. Saham Barito Pacific (BRPT) tiba-tiba berbalik arah pada 12 Mei kemarin.|Netral
Profil I Ketut Pasek Senjaya Putra, Direktur Utama Baru WIKA. RUPST PT Wijaya Karya Tbk (WIKA) untuk tahun buku 2025 resmi menghasilkan keputusan penting. Salah satunya, mengangkat Direktur Utama baru.|Netral
Ray Dalio Serang Bitcoin, Michael Saylor Langsung Balas Keras. Ray Dalio kritik Bitcoin sebagai safe haven, Michael Saylor membalas keras di tengah peluang BTC menuju US$ 85.000|Positif
Harga Emas Bisa Meledak ke US$ 17.250. Harga emas diprediksi meledak ke US$ 17.250 imbas lonjakan utang Amerika Serikat. Pengusaha tambang memiliki skenario harga emas yang tinggi|Positif
Sinyal Penting Saham BBRI. Spinning bottom pasca uji MA20 3.170 menjadi sinyal awal rebound saham BBRI yang dikonfirmasi jika mampu breakout dari resistance 3.310.|Positif
Harga Emas Perhiasan Hari Ini, Rabu 13 Mei 2026, Cek Rinciannya. Harga emas perhiasan hari ini, Rabu (13/5/2026) di Raja Emas Indonesia, Hartadinata Abadi, dan Laku Emas dalam berbagai karat|Netral
Saham BBCA Masih Downtrend, Jangan-jangan Jadi Segini. Saham Bank Central Asia (BBCA) disebut masih dalam fase downtrend.|Negatif
Ahli Bilang Tren Harga Emas Bakal Begini. Kalangan ahli memproyeksikan harga emas akan mencapai level ini hingga akhir 2026. Prospek harga emas masih optimistis.|Positif
Harga Bitcoin (BTC) Tumbang, Dihantam Inflasi AS. Harga Bitcoin (BTC) tumbang usai inflasi AS melonjak dan pasar khawatir The Fed kembali menaikkan suku bunga|Negatif
Gara-gara Pengumuman MSCI. BRIDS menaksir gara-gara pengumuman MSCI bisa berdampak besar ke pasar.|Negatif
Pasar Emas Perhiasan Dihantui Perlambatan. Negara konsumen emas terbesar kedua di dunia mulai mengantisipasi perlambatan sementara pada permintaan emas perhiasan.|Negatif
Dividen Telkom (TLKM) Usai Ungkap Laba, plus Rencana Aksi. Telkom (TLKM) membeberkan hasil laba, serta mengungkap rencana dividen dan aksi korporasi. Simak juga target harga saham TLKM.|Positif
IHSG Tertekan Rebalancing MSCI, tapi 5 Saham Bisa Kasih Cuan. Phintraco Sekuritas memprediksi IHSG hari ini tertekan rebalancing MSCI, tapi rekomendasikan 5 saham bisa kasih cuan, salah satunya ADRO|Positif
Harga CPO Anjlok Kena Tekanan ganda. Harga CPO di Bursa Malaysia Derivatives anjlok akibat tekanan pasar China dan kenaikan stok minyak sawit Malaysia|Negatif
India Rem Impor Emas, Pajak Kini 15%. India menaikkan pajak impor emas menjadi 15% demi menjaga devisa. Risiko penyelundupan emas kembali mengintai.|Negatif
Pengumuman MSCI: 6 Saham RI Keluar dari Indeks Global Standard. MSCI Inc akhirnya mengumumkan hasil tinjauan indeks Mei 2026.|Negatif
BERITA POPULER: Harga Emas Antam (ANTM) Meroket hingga Geliat Emas Perhiasan. Berita populer dalam 24 jam terakhir, mulai dari harga emas Antam (ANTM) meroket hingga geliat emas perhiasan|Positif
Harga Minyak Menggila, Dunia Dibayangi Krisis Pasokan. Harga minyak dunia melonjak di tengah memanasnya konflik AS-Iran dan ancaman krisis pasokan energi global|Negatif
Wall Street Goyang, Harga Minyak dan Inflasi Bikin Pasar Ketar-ketir. Wall Street mayoritas melemah usai inflasi AS naik dan harga minyak melonjak akibat konflik Iran yang kembali memanas|Negatif
Harga Emas Rontok, Minyak Meledak. Harga emas turun usai minyak melonjak 3% akibat konflik Iran memanas. Pasar khawatir suku bunga tinggi bertahan lama|Negatif
Medela Potentia (MDLA) Perluas Distribusi dan Eksplor Mitra Baru. PT Medela Potentia Tbk (MDLA) menetapkan strategi pertumbuhan berkelanjutan sebagai fokus utama operasional sepanjang 2026. Apa strateginya?|Positif
Net Sell Beruntun, Asing Fokus Obral Saham Ini. Investor asing melanjutkan aksi jual bersih (net sell) pada Selasa (12/5/2026). Giliran saham ANTM diobral asing, plus BMRI, CUAN, DSSA.|Negatif
Brigit Biofarmaka (OBAT) Ekspansi Pasar Malaysia dan Vietnam. PT Brigit Biofarmaka Teknologi Tbk (OBAT) menggelar ekspansi bisnis dengan memperkuat jaringan pasar ekspor ke dua negara. Apa alasannya?|Positif
Tekanan ke Rupiah Bisa Berlanjut Karena MSCI. Core Indonesia menilai tekanan rupiah masih berpotensi berlanjut jelang pengumuman rebalancing MSCI.|Negatif
Siloam (SILO) Lanjutkan Investasi. PT Siloam International Hospitals Tbk (SILO), emiten rumah sakit Grup Lippo, terus melanjutkan investasinya di 2026. Apa saja targetnya?|Positif
Indodax Soroti Pentingnya Perlindungan Konsumen. Inovasi tanpa perlindungan konsumen tidak lagi menjadi opsi yang dapat ditoleransi.|Netral
Saham BBRI Diteropong, Muncul Ini. Saham BBRI atau BRI secara valuasi masih relatif menarik. Simak rekomendasi dan target harga saham BBRI.|Positif
Prediksi IHSG dan Rekomendasi Saham Rabu, 13 Mei 2026. Indeks harga saham gabungan (IHSG) berpotensi menguji level 6.700-6.750 pada perdagangan, Rabu (13/5/2026).|Netral
Prediksi Harga Emas Antam (ANTM) Rabu 13 Mei 2026. Harga emas Antam (ANTM) diperkirakan bergerak fluktuatif pada Rabu,13 Mei 2026. Harga emas Antam diprediksi naik ke level ini.|Positif
Arah Rupiah Usai Tembus Rp 17.500. Pada perdagangan Selasa (12/5), mata uang rupiah ditutup melemah 114 poin terhadap dolar AS setelah sebelumnya sempat melemah di Rp 17.528.|Negatif
Kinerja Gemilang, MDLA Tebar Dividen Tunai Rp 176 Miliar. RUPS Tahunan PT Medela Potentia Tbk (MDLA) setujui pembagian dividen tunai tahun buku 2025 sebesar Rp 176,56 miliar.|Positif
Kapal Novah Bakal Pacu Pertumbuhan CDIA. Kapal logistik kimia cair Novah akan mendukung pertumbuhan PT Chandra Daya Investasi Tbk (CDIA).|Positif
IHSG Melemah, tapi 5 Saham Melesat di Atas 20%. Indeks harga saham gabungan (IHSG) hari ini, Selasa (12/5/2026), ditutup melemah 46,72 poin (0,68%) ke level 6.858,9.|Negatif
KETR Terbitkan Obligasi Rp 220 M, Bangun Kabel Laut Merindo. Penerbitan obligasi Rp 220 miliar ini merupakan tahap pertama dari program pembiayaan berkelanjutan senilai Rp 730 miliar.|Netral
Harga Emas Hari Ini, Selasa 12 Mei 2026, di BSI, HRTA, Lotus Archi & Minigold. Simak harga emas di BSI, HRTA (Emasku & EmasKita), Lotus Archi, dan Minigold pada hari ini, Selasa 12 Mei 2026|Netral
Rupiah Kehabisan Tenaga Hadapi Tekanan Beruntun. Pada perdagangan Selasa (12/5), mata uang rupiah ditutup melemah 114 poin terhadap dolar AS setelah sebelumnya sempat melemah di Rp 17.528.|Negatif
Saham Konglo Kakap Lagi Diobral, Serok Sekarang Diramal Cuan 29%. Saham PT Surya Semesta Internusa Tbk (SSIA), emiten milik konglomerat, lagi diskon besar. Target harga saham SSIA segini.|Positif
Astra (ASII), Seberapa Menarik? Ada Target Harga Baru. Astra (ASII) bakal menempuh jalur pemulihan kinerja yang lebih bertahap. Muncul target harga baru saham ASII.|Netral
Saham ANTM Mendadak Jadi Bulan-bulanan. Asing bermanuver dengan melakukan aksi jual di saham PT Antam Tbk (ANTM).|Negatif
Rupiah Tembus Rp 17.500, Purbaya: Kami Siap Masuk ke Bond Market. Menteri Keuangan Purbaya Yudhi Sadewa menanggapi pelemahan nilai tukar rupiah yang sudah mencapai Rp 17.500 per dolar AS.|Negatif
Heboh Whale Bitcoin (BTC) Bangun dari Tidur 12 Tahun, Pindahkan Aset Raksasa. Investor misterius pindahkan 500 Bitcoin senilai miliaran setelah 12 tahun diam. Cuan 89 kali lipat sejak 2013! Simak detailnya.|Positif
Asing Cabut dari Saham Emiten Grup Sinar Mas. DSSA atau Dian Swastatika Sentosa, saham emiten Grup Sinar Mas, terbanyak dilepas investor asing. Ini menimpa DSSA jelang pengumuman MSCI.|Negatif
IHSG Dilanda Aksi Jual Masif Gara-Gara Ini. IHSG hari ini dilanda aksi jual masif akibat konflik AS-Iran, rupiah melemah, dan tekanan sentimen global|Negatif
Hadapi Hantavirus, CHEK Siapkan Berbagai Lini Pemeriksaan. PT Diastika Biotekindo Tbk (CHEK) berupaya menghadapi ancaman Hantavirus dengan berbagai lini pemeriksaan penunjang.|Positif
Harga Emas Perhiasan Hari Ini, Selasa 12 Mei 2026, Cek Update-nya. Harga emas perhiasan hari ini, Selasa (12/5/2026) di Hartadinata Abadi, Raja Emas Indonesia, dan Laku Emas berbagai karat. Berikut updatenya|Netral
LPCK Rombak Direksi dan Komisaris, Siap Ngebut Garap Properti Cikarang. LPCK rombak direksi dan komisaris usai RUPST 2026, siap percepat ekspansi properti dan kawasan Cikarang|Positif
IHSG Turun Tajam, Cuan 5 Saham Justru Meledak. IHSG hari ini turun tajam 1,43% pada sesi I. Cuan 5 saham justru meledak dan teratas dalam daftar top gainers. Bahkan ada 3 saham yang ARA|Positif
Saham Emiten Grup Sinar Mas Dilahap Terus. Saham Dian Swastatika Sentosa (DSSA) malah loncat jelang pengumuman MSCI.|Positif
Biang Kerok Rupiah Terperosok. Nilai tukar rupiah terhadap dolar AS kembali melemah menembus level Rp 17.500. Ini yang menjadi biang kerok rupiah terperosok.|Negatif
Nasib Harga Emas Beberapa Hari ke Depan, Ramalan Pakar. Harga emas diperkirakan akan tetap berada dalam kisaran volatilitas tipikal antara US$ 4.650 dan US$ 4.810.|Netral
Info Soal Hantavirus dari LABS. PT UBC Medical Indonesia Tbk (LABS) angkat bicara terkait ancaman penyebaran Hantavirus di Indonesia.|Netral
Harga Emas Digital Hari Ini, Selasa 12 Mei 2026: Naik Pesat. Harga emas digital hari ini, Selasa 12 Mei 2026, dari berbagai platform emas digital seperti Treasury, Lakuemas, dan ShariaCoin.|Positif
Kabar Buruk buat IHSG. IHSG melemah karena berbagai sentimen negatif.|Negatif
Harga Emas Antam (ANTM), UBS, dan Galeri 24 di Pegadaian, Selasa 12 Mei 2026. Harga emas Antam (ANTM), UBS, dan Galeri 24 di Pegadaian hari ini, Selasa (12/5/2025). Cek update lengkapnya|Netral
Makin Tertekan, Rupiah Tembus Rp 17.500. Nilai tukar rupiah (IDR) kembali anjlok tajam dengan menembus level Rp 17.500 per dolar AS pada Selasa siang (12/5/2026).|Negatif
Harga Emas Bisa Berubah Cepat, Ada Penggeraknya. Berikut adalah beberapa faktor yang memengaruhi pergerakan harga emas. Simak juga update proyeksi harga emas 2026.|Netral
Penyebab Saham BBCA Anjlok. Saham Bank Central Asia (BBCA) kembali jadi memerah terus. Ada apa?|Negatif
Bocoran Pengumuman MSCI. MSCI akan mengumumkan index review pada 12 Mei waktu setempat.|Netral
FORE Kopi Kian Harum. Racikan PT Fore Kopi Indonesia Tbk (FORE) semakin mengeluarkan aroma harum. Apa saja pemicu kinerja emiten kopi ini semakin sedap diseruput?|Positif
Nilai Tukar Rupiah Hari Ini, Selasa 12 Mei 2026: Terus-terusan Merosot ke Zona Merah. Nilai tukar (kurs) rupiah hari ini pada Selasa (12/5/2026) terpantau tertekan. Rupiah melemah ke level ini.|Negatif
IHSG Menanjak, 2 Saham Langung Naik hingga Mentok ARA. IHSG hari ini menanjak 0,6%. 5 saham naik tajam dan masuk daftar top gainers, bahkan ada 2 yang langsung naik hingga mentok ARA|Positif
Harga Perak Antam (ANTM) Hari Ini, Selasa 12 Mei 2026: Melonjak Signifikan. Harga perak Antam (ANTM) hari ini pada Selasa (12/5/2026) terpantau melonjak signifikan. Harga perak Antam naik tajam ke level ini.|Positif
Saham BREN dan 3 Lainnya Masuk UMA. Bursa Efek Indonesia (BEI) memantau pergerakan Unusual Market Activity (UMA) terhadap empat saham emiten, pada Selasa (12/5/2026).|Netral
Harga Emas Antam (ANTM) Hari Ini, Selasa 12 Mei 2026: Meledak Tinggi. Harga emas Antam (ANTM) terpantau meledak tinggi pada Selasa (12/5/2026). Cek juga harga beli kembali (buyback) emas Antam|Positif
Saham PBV 0,2 Diam-diam Lagi Naik, Diramal Tembus Segini. Saham Panin Financial (PNLF) diam-diam melonjak 11,29% dalam sepekan terakhir.|Positif
Investor Saham Diimbau Tidak Panik. Short-term pain, but long-term gain. Pasar modal menjadi jauh lebih sehat.|Positif
IHSG Berpotensi Lanjut Melemah, tapi 6 Saham Tahan Gempuran. Indeks harga saham gabungan (IHSG) diprediksi akan bergerak melemah pada perdagangan Selasa (12/5/2026).|Negatif
Saham Pilihan untuk Trading 12 Mei dan Target Harganya. IHSG bakal menguat, rekomendasi saham pilihan ASII, BUMI, WIFI hingga PTRO untuk trading hari ini dengan target harganya|Positif
IHSG Bakal Diuji, tapi 3 Saham Siap Cuan. Indeks harga saham gabungan (IHSG) diprediksi masih akan diuji di rentang support 6.8506.960 pada perdagangan, Selasa (12/5/2026).|Positif
Saham BUMI Masih Berat, Jangan-jangan Jadi Segini. Saham Bumi Resources (BUMI) kembali membukukan net sell asing.|Negatif
Nasib BREN, BEI Ungkap Sikap Terbaru. Saham Barito Renewables Energy (BREN) terus anjlok.|Negatif
Saham PBV di Bawah 1, Dividennya hampir Rp 5.000. Cikarang Listrindo Tbk (POWR) akan membagikan dividen final tahun buku 2025 senilai US$ 45,12 juta atau Rp 785,08 miliar.|Positif
Harga Emas Dapat Momentum Lagi. Harga emas kembali mendapatkan momentum dari optimisme tentang kesepakatan perdamaian antara AS dan Iran.|Positif
Perubahan Mendadak di Saham BBRI. Saham Bank Rakyat Indonesia (BBRI) tiba-tiba membukukan net sell asing.|Negatif
