ID|Teks_Gabungan|Label_Sentimen|Tanggal|Link
741|Harga Perak Antam (ANTM) Hari Ini, Sabtu 9 Mei 2026: Naik Pesat. Harga perak Antam (ANTM) hari ini pada Sabtu (9/5/2026) terpantau naik pesat. Harga perak Antam melambung ke level ini.||"9 Mei 2026 | 09:01 WIB"|https://investor.id/market/438516/harga-perak-antam-antm-hari-ini-sabtu-9-mei-2026-naik-pesat
742|Harga Emas Antam (ANTM) Hari Ini, Sabtu 9 Mei 2026: Tak Goyah. Harga emas Antam (ANTM) terpantau tak goyah pada Sabtu (9/5/2026). Cek juga harga beli kembali (buyback) emas Antam||"9 Mei 2026 | 08:35 WIB"|https://investor.id/market/438515/harga-emas-antam-antm-hari-ini-sabtu-9-mei-2026-tak-goyah
743|Saham Terbang 855%, Faktanya Begini. BEI menerbitkan pengumuman saham terkonsentrasi tinggi atas saham BSA Logistics Indonesia (WBSA).||"9 Mei 2026 | 08:23 WIB"|https://investor.id/market/438514/saham-terbang-855-faktanya-begini
744|Sejarah Baru Aksi Beli Emas. Pembelian emas bersejarah dilakukan oleh sebuah bank sentral di kawasan Eropa Timur.||"9 Mei 2026 | 08:05 WIB"|https://investor.id/market/438500/sejarah-baru-aksi-beli-emas
745|Bluebird (BIRD) Tak Lagi Sekadar Taksi. Bluebird (BIRD) bertransformasi jadi ekosistem mobilitas digital, dari taksi hingga shuttle dan logistik||"9 Mei 2026 | 07:58 WIB"|https://investor.id/market/438513/bluebird-bird-tak-lagi-sekadar-taksi
746|Pasar Emas Mulai Seret. Permintaan emas kembali melemah di negara konsumen logam mulia terbesar kedua di dunia.||"9 Mei 2026 | 07:10 WIB"|https://investor.id/market/438502/pasar-emas-mulai-seret
747|Harga CPO Terperosok, Pasar Pantau Perdamaian Timur Tengah. Harga CPO di Bursa Malaysia Derivatives terperosok akibat tekanan pasokan dan pasar yang memantau konflik Timur Tengah||"9 Mei 2026 | 07:08 WIB"|https://investor.id/market/438512/harga-cpo-terperosok-pasar-pantau-perdamaian-timur-tengah
748|Harga Emas Perhiasan Hari Ini, Sabtu 9 Mei 2026, Cek Rinciannya. Harga emas perhiasan hari ini, Sabtu (9/5/2026) di Raja Emas Indonesia, Hartadinata Abadi, dan Laku Emas dalam berbagai karat||"9 Mei 2026 | 07:00 WIB"|https://investor.id/market/438510/harga-emas-perhiasan-hari-ini-sabtu-9-mei-2026-cek-rinciannya
749|Ahli Buka-bukaan Outlook Harga Emas Bakal Begini. Harga emas diprediksi memasuki tren baru. Ahli komoditas memproyeksi harga emas spot bergerak ke level ini.||"9 Mei 2026 | 06:40 WIB"|https://investor.id/market/438499/ahli-bukabukaan-outlook-harga-emas-bakal-begini
750|BERITA POPULER: Dinamika Harga Emas Perhiasan hingga FORE Berubah Total. Berita populer dalam 24 jam terakhir, mulai dari dinamika harga emas perhiasan hingga FORE berubah total||"9 Mei 2026 | 06:03 WIB"|https://investor.id/market/438509/berita-populer-dinamika-harga-emas-perhiasan-hingga-fore-berubah-total
751|Harga Minyak Melonjak usai Konflik AS dan Iran Memanas. Harga minyak sempat melonjak 3% usai konflik AS-Iran memanas di Selat Hormuz, namun pasar masih berharap damai||"9 Mei 2026 | 05:23 WIB"|https://investor.id/market/438508/harga-minyak-melonjak-usai-konflik-as-dan-iran-memanas
752|Wall Street Cetak Rekor Baru, Ditopang Data Tenaga Kerja dan Optimisme AI. Wall Street cetak rekor ATH baru didorong data tenaga kerja AS yang kuat dan reli saham AI di tengah tensi AS-Irak||"9 Mei 2026 | 05:02 WIB"|https://investor.id/market/438507/wall-street-cetak-rekor-baru-ditopang-data-tenaga-kerja-dan-optimisme-ai
753|Harga Emas Terkerek Harapan Perdamaian AS dan Iran. Harga emas dunia menguat dipicu harapan perdamaian AS-Iran dan meningkatnya peluang pemangkasan suku bunga The Fed||"9 Mei 2026 | 04:37 WIB"|https://investor.id/market/438504/harga-emas-terkerek-harapan-perdamaian-as-dan-iran
754|Penyebab Laba SIG Melonjak 88% Terungkap. PT Semen Indonesia Tbk (SIG/SMGR) mulai menuai hasil dari strategi transformasi, terlihat pada lonjakan laba bersih 88% kuartal I-2026.||"9 Mei 2026 | 00:49 WIB"|https://investor.id/market/438479/penyebab-laba-sig-melonjak-88-terungkap
755|XTB Hadirkan Fitur Verifikasi Panggilan Real-Time untuk Tingkatkan Perlindungan Investor. XTB Indonesia resmi menghadirkan fitur verifikasi panggilan secara real-time langsung di dalam aplikasi.||"8 Mei 2026 | 22:32 WIB"|https://investor.id/market/438489/xtb-hadirkan-fitur-verifikasi-panggilan-realtime-untuk-tingkatkan-perlindungan-investor
756|Mitratel Bakal Terimbas Dahsyat Ekspansi Sinar Mas dan WIFI. Mitratel diprediksi terimbas ekspansi Sinar Mas dan WIFI di bisnis internet rakyat.||"8 Mei 2026 | 21:25 WIB"|https://investor.id/market/438478/mitratel-bakal-terimbas-dahsyat-ekspansi-sinar-mas-dan-wifi
757|Laba ADRO Meledak, Dividen Membara Menanti, Kira-kira Segini. ADRO membukukan pertumbuhan laba bersih 67% menjadi US$ 128 juta kuartal I-2026. Target harga saham dan dividen ADRO segini.||"8 Mei 2026 | 20:40 WIB"|https://investor.id/market/438475/laba-adro-meledak-dividen-membara-menanti-kirakira-segini
758|Kompetisi Emiten Telko TLKM, EXCL, dan ISAT Bergeser. Kompetisi antara PT Telkom Indonesia Tbk (TLKM), PT XL Smart Telecom Tbk (EXCL), dan PT Indosat Tbk (ISAT) mengalami pergeseran. Bagaimana?||"8 Mei 2026 | 20:00 WIB"|https://investor.id/market/438469/kompetisi-emiten-telko-tlkm-excl-dan-isat-bergeser
759|Prediksi Harga Emas Antam (ANTM) Sabtu 9 Mei 2026. Harga emas Antam (ANTM) diperkirakan bergerak fluktuatif pada Sabtu, 9 Mei 2026. Harga emas Antam diprediksi naik ke level ini.||"8 Mei 2026 | 18:00 WIB"|https://investor.id/market/438379/prediksiharga-emas-antam-antm-sabtu-9mei-2026
760|Nasib Rupiah Pekan Depan Bakal Begini. Pada perdagangan Jumat (8/5/2026), rupiah ditutup melemah 49 poin terhadap dolar AS setelah sebelumnya sempat melemah di Rp 17.382.||"8 Mei 2026 | 17:30 WIB"|https://investor.id/market/438443/nasib-rupiah-pekan-depan-bakal-begini
761|Nasib Rupiah Pekan Depan Bakal Begini. Pada perdagangan Jumat (8/5/2026), rupiah ditutup melemah 49 poin terhadap dolar AS setelah sebelumnya sempat melemah di Rp 17.382.||"8 Mei 2026 | 17:30 WIB"|https://investor.id/market/438443/nasib-rupiah-pekan-depan-bakal-begini
762|IHSG Anjlok, tapi Deretan Saham Ini Kasih Cuan Gede. Indeks harga saham gabungan (IHSG) hari ini, Jumat (8/5/2026), ditutup anjlok 204,93 poin (2,86%) ke level 6.969,4.||"8 Mei 2026 | 16:25 WIB"|https://investor.id/market/438452/ihsg-anjlok-tapi-deretan-sahamini-kasih-cuan-gede
763|RMKE Kantongi Lonjakan Pendapatan. RMK Energy (RMKE) mencatat kinerja impresif pada kuartal I-2026.||"8 Mei 2026 | 16:01 WIB"|https://investor.id/market/438448/rmke-kantongi-lonjakan-pendapatan
764|Investasi Emas Digital Aman atau Tidak? Ini Penjelasannya!. Di Pegadaian tersedia layanan, seperti Tabungan Emas dan Cicil Emas yang memungkinkan nasabah berinvestasi emas dengan mudah.||"8 Mei 2026 | 15:52 WIB"|https://investor.id/market/438446/investasi-emas-digital-aman-atau-tidak-ini-penjelasannya
765|Dividen BBRI Dibayarkan Hari Ini, Investor Panen Cuan. BRI hari ini membayar dividen final kepada para pemegang saham senilai Rp209 per saham.||"8 Mei 2026 | 15:46 WIB"|https://investor.id/market/438445/dividen-bbri-dibayarkan-hari-ini-investor-panen-cuan
766|Saham Tambang Jatuh Gara-gara Ini. Saham sejumlah emiten pertambangan ambruk pada sesi II hari ini.||"8 Mei 2026 | 15:42 WIB"|https://investor.id/market/438444/saham-tambang-jatuhgaragara-ini
767|Harga Bitcoin (BTC) Ambrol ke Bawah US$ 80.000, Ini Penyebabnya. Koreksi harga bitcoin (BTC) ke bawah US$ 80.000 terjadi dalam situasi risk-off akibat sentimen hantavirus.||"8 Mei 2026 | 15:23 WIB"|https://investor.id/market/438441/harga-bitcoin-btc-ambrol-ke-bawah-us-80000-ini-penyebabnya
768|Rupiah Lagi-lagi Tergelincir Sentimen Beruntun. Pada perdagangan Jumat (8/5/2026), rupiah ditutup melemah 49 poin terhadap dolar AS setelah sebelumnya sempat melemah di Rp 17.382.||"8 Mei 2026 | 15:22 WIB"|https://investor.id/market/438440/rupiah-lagilagi-tergelincir-sentimen-beruntun
769|Ada Raja Kripto dalam Aksi Terbaru CBRE. Investor yang dikenal sebagai “raja kripto” Indonesia, Gabriel Rey, melalui entitas PT Pukul Rata Kanan, resmi memiliki 1,01% saham CBRE.||"8 Mei 2026 | 14:48 WIB"|https://investor.id/market/438434/ada-raja-kripto-dalam-aksi-terbaru-cbre
770|Terbang 211%, Saham ASPR Tetiba Dibanting. Saham Asia Pramulia (ASPR) akhirnya dibanting.||"8 Mei 2026 | 13:25 WIB"|https://investor.id/market/438427/terbang-211-saham-aspr-tetibadibanting
771|Saham BMRI Jadi Bulan-bulanan. Asing bermanuver dengan melakukan aksi jual di saham PT Bank Mandiri (Persero) Tbk (BMRI).||"8 Mei 2026 | 12:57 WIB"|https://investor.id/market/438421/saham-bmri-jadi-bulanbulanan
772|Konflik AS dan Iran hingga Rupiah Tekan IHSG. Pialrmas menjelaskan, IHSG hari ini melemah akibat konflik AS-Iran, pelemahan rupiah, dan meningkatnya ketidakpastian global||"8 Mei 2026 | 12:55 WIB"|https://investor.id/market/438420/konflik-as-dan-iran-hingga-rupiah-tekan-ihsg
773|Harga Emas Menuju Keuntungan Mingguan di Tengah Harapan Damai AS-Iran. Harga emas naik 2,2% pekan ini berkat optimisme kesepakatan damai AS-Iran dan meredanya kekhawatiran inflasi. Simak analisis lengkapnya.||"8 Mei 2026 | 12:35 WIB"|https://investor.id/market/438419/harga-emas-menuju-keuntungan-mingguan-di-tengah-harapan-damai-asiran
774|Saham BBRI Jadi Primadona. Asing bermanuver dengan melakukan aksi beli paling banyak di saham PT Bank Rakyat Indonesia (Persero) Tbk (BBRI).||"8 Mei 2026 | 12:35 WIB"|https://investor.id/market/438418/saham-bbri-jadi-primadona
775|Harga Emas Perhiasan Hari Ini, Jumat 8 Mei 2026, Cek Update-nya. Harga emas perhiasan hari ini, Jumat (8/5/2026) di Hartadinata Abadi, Raja Emas Indonesia, dan Laku Emas berbagai karat. Berikut updatenya||"8 Mei 2026 | 12:35 WIB"|https://investor.id/market/438417/harga-emas-perhiasan-hari-ini-jumat-8-mei-2026-cek-updatenya
776|Kebangkitan Saham Bank Besar. Kalangan analis percaya, saham-saham big bank tersebut masih memiliki keleluasaan untuk terus mengarah ke atas.||"8 Mei 2026 | 12:30 WIB"|https://investor.id/market/438406/kebangkitan-saham-bank-besar
777|Bitcoin (BTC) Sempat Sentuh US$ 80.000, Simak 5 Indikator Kritisnya. Bitcoin sempat tembus US$ 80.000 sebelum terkoreksi akibat konflik Timur Tengah. Simak 5 indikator kunci penentu arah harga BTC pekan ini.||"8 Mei 2026 | 12:28 WIB"|https://investor.id/market/438416/bitcoin-btc-sempat-sentuh-us-80000-simak-5-indikator-kritisnya
778|Anabatic (ATIC) Tunjuk Irfan Setiaputra Jadi Presiden Komisaris Baru. Anabatic (ATIC) tunjuk Irfan Setiaputra sebagai Presiden Komisaris baru untuk memperkuat ekspansi bisnis digital||"8 Mei 2026 | 12:10 WIB"|https://investor.id/market/438413/anabatic-atic-tunjuk-irfan-setiaputra-jadi-presiden-komisaris-baru
779|ITSEC Asia (CYBR) Stock Split 1:2. PT ITSEC Asia Tbk (CYBR) akan menggelar aksi korporasi pemecahan nilai nominal saham atau stock split dengan rasio 1:2.||"8 Mei 2026 | 12:03 WIB"|https://investor.id/market/438412/itsec-asia-cybr-stock-split12
780|IHSG Loyo, 6 Saham Justru Perkasa. IHSG hari ini loyo pada sesi I. 6 saham justru perkasa dan masuk daftar top gainers, bahkan ada yang ARA||"8 Mei 2026 | 11:52 WIB"|https://investor.id/market/438410/ihsg-loyo-6-saham-justru-perkasa
781|Bayu Buana Akuisisi Hotel di Makassar. Perseroan telah menganggarkan dana Rp100 miliar untuk membiayai akuisisi hotel bintang empat tersebut.||"8 Mei 2026 | 11:52 WIB"|https://investor.id/market/438409/bayu-buana-akuisisi-hotel-di-makassar
782|Harga Emas Digital Hari Ini, Jumat 8 Mei 2026. Harga emas digital hari ini, Jumat 8 Mei 2026, dari berbagai platform emas digital seperti Treasury, Lakuemas, IndoGold, ShariaCoin.||"8 Mei 2026 | 11:44 WIB"|https://investor.id/market/438408/harga-emas-digital-hari-ini-jumat-8-mei-2026
783|Yang Bikin Saham BBRI Menjadi-jadi. Saham Bank Rakyat Indonesia (BBRI) kembali menghijau di sesi I hari ini.||"8 Mei 2026 | 11:32 WIB"|https://investor.id/market/438404/yang-bikin-saham-bbri-menjadijadi
784|Lautan Luas (LTLS) Tebar Dividen Rp 45,4 Miliar. Lautan Luas (LTLS) bagikan dividen Rp45,4 miliar atau Rp31 per saham di tengah kinerja solid sepanjang 2025||"8 Mei 2026 | 11:27 WIB"|https://investor.id/market/438403/lautan-luas-ltls-tebar-dividen-rp-454-miliar
785|Harga Emas Antam (ANTM), UBS, dan Galeri 24 di Pegadaian, Jumat 8 Mei 2026. Harga emas Antam (ANTM), UBS, dan Galeri 24 di Pegadaian hari ini, Jumat (8/5/2025). Cek update lengkapnya||"8 Mei 2026 | 10:56 WIB"|https://investor.id/market/438400/harga-emas-antam-antm-ubs-dan-galeri-24-di-pegadaian-jumat-8-mei-2026
786|BIPI Buka-bukaan, Butuh Rp 86 Triliun. BIPI atau Astrindo Nusantara Infrastruktur buka-bukaan soal transformasi besar. BIPI memperkirakan kebutuhan capex sekitar Rp 86 triliun.||"8 Mei 2026 | 10:51 WIB"|https://investor.id/market/438399/bipi-bukabukaan-butuh-rp-86-triliun
787|Saham BBCA Melejit, Ini Pemicunya. Saham Bank Central Asia (BBCA) kembali bergerak kuat di sesi I hari ini.||"8 Mei 2026 | 10:50 WIB"|https://investor.id/market/438398/saham-bbca-melejit-ini-pemicunya
788|ARCI Genjot Kapasitas Smelter. PT Archi Indonesia Tbk (ARCI) terus memperkuat fasilitas pengolahan emas dengan menggenjot kapasitas pabrik smelter hingga naik tajam.||"8 Mei 2026 | 10:30 WIB"|https://investor.id/market/438382/arcigenjot-kapasitas-smelter
789|Baru Dicaplok, Saham Emiten Dilepas Banyak Pengendali Baru, Transaksinya FOP. Pengendali baru Geoprima Solusi (GPSO) menjual 12% saham perseroan.||"8 Mei 2026 | 10:16 WIB"|https://investor.id/market/438396/baru-dicaplok-saham-emiten-dilepas-banyak-pengendali-baru-transaksinyafop
790|IHSG Melemah, 6 Saham Justru Naik Tajam. IHSG hari ini melemah pada sejam perdagangan. 6 saham justru naik tajam dan masuk daftar top gainers, bahkan ada yang ARA||"8 Mei 2026 | 10:10 WIB"|https://investor.id/market/438394/ihsg-melemah-6-saham-justru-naik-tajam
791|Momen Akumulasi Saham BBRI. Saham BBRI atau BRI menarik untuk akumulasi. Begini strategi masuk di saham BBRI.||"8 Mei 2026 | 10:10 WIB"|https://investor.id/market/438391/momen-akumulasi-saham-bbri
792|Mengintip Aksi Jual Emas Terbesar di 2026. Aksi jual emas di antara bank-bank sentral global telah mencapai 30 ton emas pada Maret 2026.||"8 Mei 2026 | 10:00 WIB"|https://investor.id/market/438392/mengintipaksi-jual-emas-terbesar-di-2026
793|Kisah FORE Berubah Drastis. Kisah pergerakan saham Fore Kopi Indonesia (FORE) berubah drastis pada 2 hari bursa ini.||"8 Mei 2026 | 09:29 WIB"|https://investor.id/market/438388/kisah-fore-berubah-drastis
794|RUPST ADHI Angkat Komisaris Baru. RUPST PT Adhi Karya (Persero) Tbk (ADHI) mengangkat Alexander Rubi Satyoadi sebagai Komisaris.||"8 Mei 2026 | 09:20 WIB"|https://investor.id/market/438387/rupst-adhi-angkat-komisaris-baru
795|Nilai Tukar Rupiah Hari Ini, Jumat 8 Mei 2026: Jatuh Lagi ke Zona Merah. ​​​​​​​Nilai tukar (kurs) rupiah hari ini pada Jumat (8/5/2026) terpantau dibuka melemah. Rupiah merosot ke level ini.||"8 Mei 2026 | 09:12 WIB"|https://investor.id/market/438386/nilai-tukar-rupiah-hari-ini-jumat-8-mei-2026-jatuh-lagi-ke-zona-merah
796|IHSG Gagal Bertahan di Zona Hijau, 5 Saham Tetap Ngebut. IHSG hari ini sempat dibuka menguat 0,12%, namun setelah itu berbalik arah. 5 saham tetap ngebut dan masuk daftar top gainers||"8 Mei 2026 | 09:11 WIB"|https://investor.id/market/438385/ihsg-gagal-bertahan-di-zona-hijau-5-saham-tetap-ngebut
797|Taktik Cuan di Saham BBRI, Mumpung Murah. Begini taktik memaksimalkan cuan di saham BBRI (BRI). Apalagi, saham BBRI relatif masih murah.||"8 Mei 2026 | 09:07 WIB"|https://investor.id/market/438383/taktik-cuan-di-saham-bbri-mumpung-murah
798|IHSG Rawan Koreksi, tapi 6 Saham Dijagokan. Indeks harga saham gabungan (IHSG) diprediksi akan rawan terkoreksi pada perdagangan, Jumat (8/5/2026).||"8 Mei 2026 | 08:55 WIB"|https://investor.id/market/438380/ihsg-rawan-koreksi-tapi-6-saham-dijagokan
799|Harga Perak Antam (ANTM) Hari Ini, Jumat 8 Mei 2026: Naik Signifikan. Harga perak Antam (ANTM) hari ini pada Jumat (8/5/2026) terpantau naik siginifikan. Harga perak Antam menguat ke level ini||"8 Mei 2026 | 08:44 WIB"|https://investor.id/market/438378/harga-perak-antam-antm-hari-ini-jumat-8-mei-2026-naik-signifikan
800|IHSG Bakal Lanjut Menguat, 3 Saham Siap Kasih Cuan. Indeks harga saham gabungan (IHSG) diprediksi akan kembali menguat untuk perdagangan, Jumat (8/5/2026).||"8 Mei 2026 | 08:43 WIB"|https://investor.id/market/438377/ihsg-bakal-lanjut-menguat-3-saham-siap-kasih-cuan
801|Harga Emas Antam (ANTM) Hari Ini, Jumat 8 Mei 2026: Tertekan. Harga emas Antam (ANTM) terpantau tertekan pada Jumat (8/5/2026). Cek juga harga beli kembali (buyback) emas Antam||"8 Mei 2026 | 08:34 WIB"|https://investor.id/market/438374/harga-emas-antam-antm-hari-ini-jumat-8-mei-2026-tertekan
802|Saham BBCA Kian Ringan, Jangan-jangan Tembus ke Sini. Saham Bank Central Asia (BBCA) lompat 4,62% kemarin.||"8 Mei 2026 | 08:32 WIB"|https://investor.id/market/438373/saham-bbca-kian-ringan-janganjangan-tembus-ke-sini
803|Laba Emiten Ngacir, PBV Cuma 0,27. Saham Panin Financial (PNLF) dapat sorotan Phintraco.||"8 Mei 2026 | 08:19 WIB"|https://investor.id/market/438372/laba-emiten-ngacir-pbv-cuma-027
804|Saham Terbang 165% hingga Masuk UMA. Bursa Efek Indonesia (BEI) memantau pergerakan Unusual Market Activity (UMA) terhadap satu saham pada Jumat (8/5/2026).||"8 Mei 2026 | 08:19 WIB"|https://investor.id/market/438371/saham-terbang-165-hingga-masuk-uma
805|Saham Pilihan untuk Trading 8 Mei dan Target Harganya. IHSG bakal melemah, rekomendasi saham pilihan BBNI, BRIS, BUMI hingga ICBP untuk trading hari ini dengan target harganya||"8 Mei 2026 | 08:08 WIB"|https://investor.id/market/438369/saham-pilihan-untuk-trading-8-mei-dan-target-harganya
806|Saham Meroket 228% Disuspensi BEI. Bursa Efek Indonesia (BEI) melakukan suspensi atau penghentian sementara terhadap saham MSIE, mulai sesi I perdagangan, Jumat (8/5/2026).||"8 Mei 2026 | 08:07 WIB"|https://investor.id/market/438368/saham-meroket-228-disuspensi-bei
807|Agenda Besar CDIA. Chandra Daya Investasi (CDIA) dijadwalkan menggelar RUPST hari ini.||"8 Mei 2026 | 08:03 WIB"|https://investor.id/market/438367/agenda-besar-cdia
808|Usai Melejit 191%, Suspensi Saham Ini Dibuka Kembali. Bursa Efek Indonesia (BEI) membuka penghentian sementara atau suspensi saham KOTA, mulai sesi I perdagangan Jumat (8/5/2026).||"8 Mei 2026 | 07:54 WIB"|https://investor.id/market/438365/usai-melejit-191-suspensi-saham-ini-dibuka-kembali
809|Sahamnya Murah, Dividennya Rp 376,95 per Saham. Cum date dividen Bank Mandiri (BMRI) jatuh hari ini.||"8 Mei 2026 | 07:40 WIB"|https://investor.id/market/438362/sahamnya-murah-dividennya-rp-37695-per-saham
810|Potensi Saham BBRI ke Batas Atas. Saham bank, PT Bank Rakyat Indonesia (Persero) Tbk (BBRI) memiliki potensi untuk menguat ke level resistance (batas atas).||"8 Mei 2026 | 07:38 WIB"|https://investor.id/market/438360/potensi-saham-bbri-ke-batas-atas
811|Emiten Boy Thohir Kasih Dividen Rp 118,26 per Saham. Alamtri Resources Indonesia (ADRO) mencairkan dividen final hari ini.||"8 Mei 2026 | 07:30 WIB"|https://investor.id/market/438358/emiten-boy-thohir-kasih-dividenrp-11826-per-saham
812|Hartadinata Abadi (HRTA) Panen Cuan di Awal 2026. Hartadinata Abadi (HRTA) mencatatkan kinerja positif pada kuartal pertama 2026. HRTA mencatat pertumbuhan pendapatan hingga 196,96%.||"8 Mei 2026 | 07:25 WIB"|https://investor.id/market/438350/hartadinata-abadi-hrta-panen-cuan-di-awal-2026
813|Asing Kompak Kabur, Saham-saham Ini Jadi Korban. Asing mencetak transaksi jual bersih (net sell), saat IHSG, Kamis (7/5/2026), ditutup menguat. Saham BMRI, BRPT dan PTRO dilepas asing.||"8 Mei 2026 | 07:22 WIB"|https://investor.id/market/438356/asing-kompak-kabur-sahamsaham-ini-jadi-korban
814|Dividen Rp 209 per Saham Cair. Bank Rakyat Indonesia (BBRI) dijadwalkan membayarkan dividen hari ini.||"8 Mei 2026 | 07:20 WIB"|https://investor.id/market/438355/dividen-rp-209-per-saham-cair
815|Asing Belanja, Saham-saham Ini Paling Banyak Dikoleksi. Asing mencetak transaksi beli bersih (net buy), saat IHSG, Kamis (7/5/2026), ditutup menguat. Saham BBRI, TINS dan GOTO diborong asing.||"8 Mei 2026 | 07:13 WIB"|https://investor.id/market/438353/asing-belanja-sahamsaham-ini-paling-banyak-dikoleksi
816|Harga Emas Perhiasan Hari Ini, Jumat 8 Mei 2026, Cek Rinciannya. Harga emas perhiasan hari ini, Jumat (8/5/2026) di Raja Emas Indonesia, Hartadinata Abadi, dan Laku Emas dalam berbagai karat||"8 Mei 2026 | 07:00 WIB"|https://investor.id/market/438349/harga-emas-perhiasan-hari-ini-jumat-8-mei-2026-cek-rinciannya
817|IHSG Mengarah ke 7.200, Simak 5 Saham Siap Cuan. Phintraco Sekuritas memprediksi IHSG hari ini mengarah ke 7.200, rekomendasikan simak lima saham siap cuan, salah satunya SCMA||"8 Mei 2026 | 05:53 WIB"|https://investor.id/market/438347/ihsg-mengarah-ke-7200-simak-5-saham-siap-cuan
818|BERITA POPULER: Geliat Harga Emas Antam (ANTM) dan Perhiasan hingga Pemicu BBCA Ngacir. Berita populer dalam 24 jam terakhir, mulai dari geliat harga emas Antam (ANTM) dan perhiasan hingga pemicu BBCA ngacir||"8 Mei 2026 | 05:06 WIB"|https://investor.id/market/438346/berita-populer-geliat-harga-emas-antam-antm-dan-perhiasan-hingga-pemicubbca-ngacir
819|Harga Minyak Tertekan, Ketidakpastian AS dan Iran Picu Volatilitas Tinggi. Harga minyak dunia melemah di tengah ketidakpastian AS-Iran dan memanasnya situasi di Selat Hormuz||"8 Mei 2026 | 04:47 WIB"|https://investor.id/market/438345/harga-minyak-tertekan-ketidakpastian-as-dan-iran-picu-volatilitas-tinggi
820|Wall Street Melemah, Pasar Lagi Deg-degan. Wall Street melemah setelah sempat cetak ATH, pasar cemas pantau harga minyak dan negosiasi AS-Iran||"8 Mei 2026 | 04:29 WIB"|https://investor.id/market/438344/wall-street-melemah-pasar-lagi-degdegan
821|Harga Emas Berbalik Lesu di Tengah Ketidakpastian Timur Tengah. ​​​​​​​Harga emas berbalik lesu di tengah ketidakpastian Timur Tengah dan lonjakan harga minyak dunia||"8 Mei 2026 | 04:17 WIB"|https://investor.id/market/438343/harga-emas-berbalik-lesu-di-tengah-ketidakpastian-timur-tengah
822|Bos BI: Intervensi Rupiah Sudah Habis-habisan, Tidak Cuma Biasa Saja. Gubernur BI Perry Warjiyo tegaskan bahwa intervensi pasar terkait rupiah sudah all out, tidak cuma biasa-biasa saja (business as usual).||"7 Mei 2026 | 20:55 WIB"|https://investor.id/market/438330/bos-bi-intervensi-rupiah-sudah-habishabisan-tidak-cuma-biasa-saja
823|60% Laba ARCI untuk Dividen. PT Archi Indonesia Tbk (ARCI) menetapkan pembagian dividen tunai total US$60 juta atau mencerminkan 60% dari laba bersih tahun buku 2025.||"7 Mei 2026 | 20:45 WIB"|https://investor.id/market/438325/60-laba-arci-untuk-dividen
824|Aksi Beli Saham BBRI Berhari-hari. Saham BBRI (BRI) menjadi yang paling banyak dibeli oleh investor asing pada Kamis (7/5/2026). Aksi beli BBRI telah berlangsung berhari-hari.||"7 Mei 2026 | 20:01 WIB"|https://investor.id/market/438320/aksi-beli-saham-bbri-berharihari
825|Rupiah Melemah saat Ekonomi Tumbuh Tinggi, Ini Penjelasan Bos BI. Gubernur BI Perry Warjiyo sebut nilai tukar rupiah turun karena kena dampak perang, serta efek musim dividen dan haji.||"7 Mei 2026 | 19:09 WIB"|https://investor.id/market/438314/rupiah-melemah-saat-ekonomi-tumbuh-tinggi-ini-penjelasan-bos-bi
826|BBCA Ternyata Paling Premium. Saham BBCA atau Bank Central Asia (BCA) tiba-tiba menanjak tinggi pada Kamis (7/5/2026). Secara valuasi, saham BBCA paling premium.||"7 Mei 2026 | 18:05 WIB"|https://investor.id/market/438309/bbca-ternyata-paling-premium
827|Prediksi Harga Emas Antam (ANTM) Jumat 8 Mei 2026. Harga emas Antam (ANTM) diperkirakan bergerak fluktuatif pada Jumat, 8 Mei 2026. Harga emas Antam diprediksi naik ke level ini.||"7 Mei 2026 | 18:00 WIB"|https://investor.id/market/438223/prediksiharga-emas-antam-antm-jumat-8-mei-2026
828|10 Juta Saham MEDC Dilepas. Sebanyak 10.017.300 saham MEDC dilepas dengan harga Rp 1.800 per saham pada 29 April 2026.||"7 Mei 2026 | 17:40 WIB"|https://investor.id/market/438305/10-juta-saham-medc-dilepas
829|Rupiah Punya Kekuatan Hadapi Sentimen Beruntun. Pada perdagangan Kamis (7/6/2026), rupiah ditutup menguat 54 poin terhadap dolar AS setelah sebelumnya sempat menguat di Rp 17.333.||"7 Mei 2026 | 17:30 WIB"|https://investor.id/market/438296/rupiah-punya-kekuatan-hadapi-sentimen-beruntun
830|Emiten Bagi Dividen Nyaris 100% Laba, Saham Diterawang Loncat 54%. Pertumbuhan laba kuat dan ekspektasi dividen besar bakal melambungkan saham HMSP. Target harga saham HMSP segini.||"7 Mei 2026 | 17:16 WIB"|https://investor.id/market/438302/emiten-bagi-dividen-nyaris-100-laba-saham-diterawang-loncat-54
831|Prediksi IHSG dan Rekomendasi Saham Jumat, 8 Mei 2026. Indeks harga saham gabungan (IHSG) berpotensi menguji level 7.200 pada perdagangan, Jumat (8/5/2026).||"7 Mei 2026 | 17:15 WIB"|https://investor.id/market/438301/prediksi-ihsg-dan-rekomendasi-saham-jumat-8-mei-2026
832|Harga Bitcoin (BTC) Turun Lagi, tapi Berpeluang ke Level Ini. Harga bitcoin (BTC) diprediksi resistance terdekat di US$ 82.820, jika BTC kembali turun, maka support pertama ada di US$ 77.423.||"7 Mei 2026 | 17:03 WIB"|https://investor.id/market/438299/harga-bitcoin-btc-turun-lagi-tapi-berpeluang-ke-level-ini
833|Laba PTBA Bakal Loncat, Target Harga Saham Direvisi Naik. Laba bersih PTBA atau Bukit Asam bakal loncat tahun ini. Target harga saham PTBA direvisi naik.||"7 Mei 2026 | 16:31 WIB"|https://investor.id/market/438293/laba-ptba-bakal-loncat-target-harga-saham-direvisi-naik
834|IHSG Melesat, Saham-saham Kasih Cuan Jumbo. Indeks harga saham gabungan (IHSG) hari ini, Kamis (7/5/2026), ditutup menguat 81,85 poin (1,15%) ke level 7.174,3.||"7 Mei 2026 | 16:26 WIB"|https://investor.id/market/438292/ihsg-melesat-sahamsaham-kasih-cuan-jumbo
835|Rupiah Tahan Banting Hadapi Ragam Sentimen Pasar. Pada perdagangan Kamis (7/6/2026), rupiah ditutup menguat 54 poin terhadap dolar AS setelah sebelumnya sempat menguat di Rp 17.333.||"7 Mei 2026 | 16:08 WIB"|https://investor.id/market/438286/rupiah-tahan-banting-hadapi-ragam-sentimen-pasar
