ID|Teks_Gabungan|Label_Sentimen|Tanggal|Link
465|Saham Emiten Aguan dan Salim Diserok, Harga Segini. PT Bangun Kosambi Sukses Tbk (CBDK) melakukan pembelian kembali (buyback) saham sebanyak 11,68 juta saham.||"14 Mei 2026 | 14:15 WIB"|https://investor.id/market/439158/saham-emiten-aguan-dan-salim-diserok-harga-segini
466|Harga Emas Hari Ini, Kamis 14 Mei 2026, di BSI, HRTA, Lotus Archi & Minigold. Simak harga emas di BSI, HRTA (Emasku & EmasKita), Lotus Archi, dan Minigold pada hari ini, Kamis 14 Mei 2026||"14 Mei 2026 | 13:00 WIB"|https://investor.id/market/439152/harga-emas-hari-ini-kamis-14-mei-2026-di-bsi-hrta-lotus-archi-minigold
467|Harga Emas Perhiasan Hari Ini, Kamis 14 Mei 2026, Cek Update-nya. Harga emas perhiasan hari ini, Kamis (14/5/2026) di Hartadinata Abadi, Raja Emas Indonesia, dan Laku Emas berbagai karat. Berikut updatenya||"14 Mei 2026 | 12:00 WIB"|https://investor.id/market/439144/harga-emas-perhiasan-hari-ini-kamis-14-mei-2026-cek-updatenya
468|Deretan Saham Dibanting Asing Habis-habisan. Asing mencetak transaksi jual bersih (net sell), saat IHSG, Rabu (13/5/2026), ditutup melemah. Saham BBRI, BMRI dan AMMN dilepas asing.||"14 Mei 2026 | 11:30 WIB"|https://investor.id/market/439139/deretan-saham-dibanting-asing-habishabisan
469|Direktur Utama VKTR Mundur, Anindya Bakrie Buka Suara. Dirut VKTR Gilarsi Wahju mundur. Anindya Bakrie pastikan bisnis dan strategi kendaraan listrik tetap berjalan normal.||"14 Mei 2026 | 11:27 WIB"|https://investor.id/market/439142/direktur-utama-vktr-mundur-anindya-bakrie-buka-suara
470|Harga Emas Digital Hari Ini, Kamis 14 Mei 2026: Turun Serentak. Harga emas digital hari ini, Kamis 14 Mei 2026, dari berbagai platform emas digital seperti Treasury, Lakuemas, dan ShariaCoin||"14 Mei 2026 | 11:07 WIB"|https://investor.id/market/439140/harga-emas-digital-hari-ini-kamis-14-mei-2026-turun-serentak
471|Deretan Saham Incaran Asing. Asing mencetak transaksi beli bersih (net buy), saat IHSG, Rabu (13/5/2026), ditutup melemah. Saham TINS, PACK dan TLKM diborong asing.||"14 Mei 2026 | 11:00 WIB"|https://investor.id/market/439137/deretan-saham-incaran-asing
472|Harga Emas Antam (ANTM), UBS, dan Galeri 24 di Pegadaian, Kamis 14 Mei 2026. Harga emas Antam (ANTM), UBS, dan Galeri 24 di Pegadaian hari ini, Kamis (14/5/2025). Cek update lengkapnya||"14 Mei 2026 | 10:32 WIB"|https://investor.id/market/439138/harga-emas-antam-antm-ubs-dan-galeri-24-di-pegadaian-kamis-14-mei-2026
473|Cengkeraman Baru Haji Isam di Bursa. Haji Isam memborong 6,83 miliar saham emiten tambang dan perdagangan nikel PT Abadi Nusantara Hijau Investama Tbk (PACK).||"14 Mei 2026 | 10:30 WIB"|https://investor.id/market/439133/cengkeraman-baru-haji-isam-di-bursa
474|Kinerja Moncer, Bank INA (BINA) Optimistis Tapi Tetap Prudent. Bank INA mencatatkan kinerja positif pada kuartal I-2026.||"14 Mei 2026 | 10:06 WIB"|https://investor.id/market/439136/kinerja-moncer-bank-inabina-optimistis-tapi-tetap-prudent
475|OJK Klaim Pasar Terkendali Usai Rebalancing MSCI, Tidak Ada Panic Selling. Otoritas Jasa Keuangan (OJK) memastikan pasar modal RI tetap terkendali setelah pengumuman rebalancing indeks global oleh MSCI.||"14 Mei 2026 | 10:00 WIB"|https://investor.id/market/439130/ojk-klaim-pasar-terkendali-usai-rebalancing-msci-tidak-ada-panic-selling
476|Harga Minyak Turun, OPEC Pangkas Proyeksi Permintaan Global. Harga minyak turun setelah OPEC pangkas proyeksi permintaan global dan pasar mewaspadai krisis Selat Hormuz||"14 Mei 2026 | 09:52 WIB"|https://investor.id/market/439134/harga-minyak-turun-opec-pangkas-proyeksi-permintaan-global
477|Harga Emas Naik, Pasar Deg-Degan Tunggu Trump dan Xi. Harga emas hari ini naik tipis di tengah pelemahan dolar AS dan fokus pasar pada pertemuan Trump-Xi Jinping di Beijing||"14 Mei 2026 | 09:31 WIB"|https://investor.id/market/439132/harga-emas-naik-pasar-degdegan-tunggu-trump-dan-xi
478|IHSG Ambles, Market Cap BEI Hilang Rp 581 Triliun. Indeks harga saham gabungan (IHSG) selama sepekan turun 3,53% sehingga ditutup pada level 6.723,3.||"14 Mei 2026 | 09:30 WIB"|https://investor.id/market/439129/ihsg-ambles-market-cap-bei-hilang-rp-581-triliun
479|Usai Rebalancing MSCI, BEI Perkuat Reformasi Pasar Modal. BEI menegaskan fokus reformasi dan transparansi pasar modal usai rebalancing MSCI di tengah volatilitas global.||"14 Mei 2026 | 09:16 WIB"|https://investor.id/market/439131/usai-rebalancing-msci-bei-perkuat-reformasi-pasar-modal
480|Harga Perak Antam (ANTM) Hari Ini, Kamis 14 Mei 2026: Melejit. Harga perak Antam (ANTM) hari ini pada Kamis (14/5/2026) terpantau melejit. Harga perak Antam melaju ke level ini||"14 Mei 2026 | 08:34 WIB"|https://investor.id/market/439127/harga-perak-antam-antm-hari-ini-kamis-14-mei-2026-melejit
481|Harga Emas Antam (ANTM) Hari Ini, Kamis 14 Mei 2026: Solid. Harga emas Antam (ANTM) terpantau solid pada Kamis (14/5/2026). Cek juga harga beli kembali (buyback) emas Antam||"14 Mei 2026 | 08:22 WIB"|https://investor.id/market/439126/harga-emas-antam-antm-hari-ini-kamis-14-mei-2026-solid
482|World Gold Council Sebut Emas Jadi Aset Strategis RI. World Gold Council menyebut emas jadi aset strategis RI di tengah inflasi, krisis global, dan tekanan pasar saham||"14 Mei 2026 | 07:53 WIB"|https://investor.id/market/439125/world-gold-council-sebut-emas-jadi-aset-strategis-ri
483|Pasar Saham Asia Pasifik Bergerak Liar, Fokus Pertemuan Trump dan Xi Jinping. Pasar saham Asia-Pasifik bergerak variatif jelang pertemuan Trump-Xi Jinping, sementara Wall Street kembali cetak rekor||"14 Mei 2026 | 07:36 WIB"|https://investor.id/market/439124/pasar-saham-asia-pasifikbergerak-liar-fokus-pertemuan-trump-dan-xi-jinping
484|Harga Emas Perhiasan Hari Ini, Kamis 14 Mei 2026, Cek Rinciannya. Harga emas perhiasan hari ini, Kamis (14/5/2026) di Raja Emas Indonesia, Hartadinata Abadi, dan Laku Emas dalam berbagai karat||"14 Mei 2026 | 07:00 WIB"|https://investor.id/market/439123/harga-emas-perhiasan-hari-ini-kamis-14-mei-2026-cek-rinciannya
485|Harga Bitcoin (BTC) Jatuh Tajam, Aksi Short Whale Bikin Pasar Gemetar. Harga Bitcoin (BTC) jatuh tajam usai aksi short whale Rp1,1 triliun mengguncang pasar kripto global||"14 Mei 2026 | 06:39 WIB"|https://investor.id/market/439122/harga-bitcoin-btc-jatuh-tajam-aksi-short-whale-bikin-pasar-gemetar
486|Harga CPO Tersungkur ke Level Terendah 2 Bulan. Harga CPO di Bursa Malaysia Derivatives jatuh ke level terendah dua bulan akibat melemahnya permintaan India dan China.||"14 Mei 2026 | 06:09 WIB"|https://investor.id/market/439120/harga-cpo-tersungkur-ke-level-terendah-2-bulan
487|Heboh Diskon Harga Emas. Diskon harga emas di India tembus rekor US$ 200 per ons usai kenaikan tarif impor picu aksi jual investor||"14 Mei 2026 | 05:27 WIB"|https://investor.id/market/439119/heboh-diskon-harga-emas
488|BERITA POPULER: Drama Pengumuman MSCI hingga Harga Emas Antam (ANTM) Rontok. Berita populer dalam 24 jam terakhir, mulai dari drama pengumuman MSCI hingga harga Emas Antam (ANTM) rontok||"14 Mei 2026 | 05:19 WIB"|https://investor.id/market/439118/berita-populer-drama-pengumuman-msci-hingga-harga-emas-antam-antm-rontok
489|Harga Minyak Ambles, Pasar Tunggu Pertemuan Trump dan Xi Jinping. Harga minyak dunia ambles akibat kekhawatiran suku bunga AS, inflasi, dan pasar menanti pertemuan Trump–Xi Jinping||"14 Mei 2026 | 05:01 WIB"|https://investor.id/market/439117/harga-minyak-ambles-pasar-tunggu-pertemuan-trump-dan-xi-jinping
490|Wall Street Cetak Rekor! Saham AI Jadi Motor Utama. Wall Street mayoritas cetak rekor ATH baru didorong saham AI, meski inflasi AS naik dan ekspektasi suku bunga The Fed tetap tinggi||"14 Mei 2026 | 04:36 WIB"|https://investor.id/market/439116/wall-street-cetak-rekor-saham-ai-jadi-motor-utama
491|Harga Emas Melemah Dua Hari Beruntun, Harapan The Fed Buyar. Harga emas melemah dua hari beruntun akibat inflasi AS, perang Iran, dan memudarnya harapan pemangkasan suku bunga||"14 Mei 2026 | 04:18 WIB"|https://investor.id/market/439115/harga-emas-melemah-duahari-beruntun-harapan-the-fed-buyar
492|Mitra10 (CSAP) Terus Ekspansi. PT Catur Mitra Sejati Sentosa atau Mitra10, anak usaha PT Catur Sentosa Adiprana Tbk (CSAP), terus ekspansi dengan membuka toko baru.||"13 Mei 2026 | 22:18 WIB"|https://investor.id/market/439109/mitra10-csap-terus-ekspansi
493|Geger MSCI, Investor Lokal Mesti Apa?. Geger MSCI kembali mengguncang pasar saham Indonesia, menyusul hasil MSCI rebalancing Mei 2026. Lantas, investor lokal mesti apa?||"13 Mei 2026 | 20:54 WIB"|https://investor.id/market/439101/geger-msci-investor-lokal-mesti-apa
494|3 Saham Diberondong Aksi Jual Asing, Net Sell Menggunung Lagi. Investor asing agresif jual bersih (net sell) dengan nilai besar pada Rabu (13/5/2026). Saham BBRI, BMRI, AMMN paling banyak dijual asing.||"13 Mei 2026 | 19:56 WIB"|https://investor.id/market/439091/3-saham-diberondong-aksi-jual-asing-net-sell-menggunung-lagi
495|Geger MSCI, Dana Asing Bisa Bergeser ke Saham Ini. Geger MSCI berpotensi mendorong rotasi likuiditas investor asing ke saham-saham, seperti BBCA, BMRI, BBNI, dan TLKM.||"13 Mei 2026 | 18:53 WIB"|https://investor.id/market/439085/geger-msci-dana-asing-bisa-bergeser-ke-saham-ini
496|Nasib Rupiah Pekan Depan Bakal Begini. Pada perdagangan Rabu (13/5), rupiah ditutup menguat 53 poin terhadap dolar AS setelah sebelumnya sempat menguat di Rp 17.475.||"13 Mei 2026 | 18:10 WIB"|https://investor.id/market/439078/nasib-rupiah-pekan-depan-bakal-begini
497|Prediksi Harga Emas Antam (ANTM) Kamis 14 Mei 2026. Harga emas Antam (ANTM) diperkirakan bergerak fluktuatif pada Kamis,14 Mei 2026. Harga emas Antam diprediksi naik ke level ini.||"13 Mei 2026 | 18:00 WIB"|https://investor.id/market/439002/prediksi-harga-emas-antam-antm-kamis-14-mei-2026
498|Prediksi IHSG dan Rekomendasi Saham Senin, 18 Mei 2026. Indeks harga saham gabungan (IHSG) diprediksi akan melanjutkan pelemahan pada perdagangan, Senin (18/5/2026).||"13 Mei 2026 | 17:30 WIB"|https://investor.id/market/439074/prediksi-ihsg-dan-rekomendasi-saham-senin-18-mei-2026
499|Plaza Indonesia (PLIN) Bagi Dividen Tunai, Cek Jadwalnya. PT Plaza Indonesia Realty Tbk (PLIN) akan membagikan dividen tunai sebesar Rp 279,3 miliar dari laba bersih tahun buku 2025.||"13 Mei 2026 | 16:51 WIB"|https://investor.id/market/439069/plaza-indonesia-plin-bagidividen-tunai-cek-jadwalnya
500|IHSG Anjlok, tapi Saham-saham Ini Menanjak. Indeks harga saham gabungan (IHSG) hari ini, Rabu (13/5/2026), ditutup melemah 135,5 poin (1,98%) ke level 6.723,3.||"13 Mei 2026 | 16:25 WIB"|https://investor.id/market/439063/ihsg-anjlok-tapi-sahamsaham-ini-menanjak
501|OJK Ungkap Penyebab MSCI Depak 18 Saham RI. Indeks global MSCI mengeluarkan 18 saham Indonesia dalam pengumuman hasil peninjauan indeks periode Mei 2026 pada Rabu (13/5).||"13 Mei 2026 | 16:19 WIB"|https://investor.id/market/439062/ojk-ungkap-penyebabmsci-depak-18-saham-ri
502|Penopang Kinerja ITMG saat Harga Batu Bara Bergejolak. PT Indo Tambangraya Megah Tbk (ITMG) mengumumkan rapor kinerja 1Q26 di tengah gejolak harga komoditas batu bara. Bagaimana nasib labanya?||"13 Mei 2026 | 16:15 WIB"|https://investor.id/market/439058/penopang-kinerja-itmg-saat-harga-batu-bara-bergejolak
503|Rupiah Balik Arah Usai Digempur Tekanan. Pada perdagangan Rabu (13/5), rupiah ditutup menguat 53 poin terhadap dolar AS setelah sebelumnya sempat menguat di Rp 17.475.||"13 Mei 2026 | 15:43 WIB"|https://investor.id/market/439053/rupiah-balik-arah-usai-digempur-tekanan
504|20 Saham Small Cap Pilihan 2026, Bisa Cuan hingga 93%. RHB menetapkan 20 saham small cap pilihan tahun 2026, dengan potensi cuan besar.||"13 Mei 2026 | 15:39 WIB"|https://investor.id/market/439052/20-saham-small-cap-pilihan-2026-bisa-cuan-hingga-93
505|Kembalikan Kepercayaan Pasar. Kekhawatiran pasar saat ini tidak hanya penurunan indeks jangka pendek, tetapi munculnya risk premium yang lebih tinggi terhadap Indonesia.||"13 Mei 2026 | 14:30 WIB"|https://investor.id/market/439044/kembalikan-kepercayaan-pasar
506|Sentimen MSCI Bikin IHSG Turun Nyaris 2%, OJK Sebut Masih Batas Wajar. OJK menyampaikan penurunan IHSG yang hampir 2% pada Rabu (13/5/2026) imbas tertekan karena rebalancing MSCI, masih dalam batas wajar.||"13 Mei 2026 | 14:28 WIB"|https://investor.id/market/439043/sentimen-msci-bikin-ihsg-turun-nyaris-2-ojk-sebut-masih-batas-wajar
507|OJK Pede Pasar Modal RI Punya Peluang ke Level Lebih Tinggi dari Emerging Market. OJK menegaskan Indonesia tidak hanya ingin bertahan di level emerging market, tetapi memiliki ambisi ke klasifikasi pasar yang lebih tinggi.||"13 Mei 2026 | 14:12 WIB"|https://investor.id/market/439040/ojk-pede-pasar-modal-ri-punya-peluang-ke-level-lebih-tinggi-dari-emerging-market
508|Harga Emas Hari Ini, Rabu 13 Mei 2026, di BSI, HRTA, Lotus Archi & Minigold. Simak harga emas di BSI, HRTA (Emasku & EmasKita), Lotus Archi, dan Minigold pada hari ini, Rabu 13 Mei 2026||"13 Mei 2026 | 13:31 WIB"|https://investor.id/market/439038/harga-emas-hari-ini-rabu-13-mei-2026-di-bsi-hrta-lotus-archi-minigold
509|Saham BBRI Dihantam Badai. Asing bermanuver dengan melakukan aksi jual di saham PT Bank Rakyat Indonesia (Persero) Tbk (BBRI).||"13 Mei 2026 | 13:29 WIB"|https://investor.id/market/439037/saham-bbri-dihantam-badai
510|Sentimen MSCI dan Inflasi AS Jadi Biang Kerok IHSG Rontok. IHSG hari ini anjlok dipicu inflasi AS, rebalancing MSCI, dan pelemahan rupiah, Pilarmas rekomendasikan saham RAJA untuk sesi II||"13 Mei 2026 | 12:51 WIB"|https://investor.id/market/439034/sentimen-msci-dan-inflasi-as-jadi-biang-kerok-ihsg-rontok
511|IHSG Minus setelah Pengumuman MSCI, Ini Kata OJK. OJK menilai kondisi tersebut menunjukkan belum adanya aksi panic selling di pasar saham domestik.||"13 Mei 2026 | 12:15 WIB"|https://investor.id/market/439029/ihsg-minus-setelah-pengumuman-msci-ini-kata-ojk
512|IHSG Tumbang, Cuan 5 Saham Malah Ngegas. IHSG hari ini tumbang 1,81%. Cuan lima saham malah ngegas dan masuk daftar top gainers, bahkan ada yang mentok ARA||"13 Mei 2026 | 12:02 WIB"|https://investor.id/market/439027/ihsg-tumbang-cuan-5-saham-malah-ngegas
513|Harga Emas Perhiasan Hari Ini, Rabu 13 Mei 2026, Cek Update-nya. Harga emas perhiasan hari ini, Rabu (13/5/2026) di Hartadinata Abadi, Raja Emas Indonesia, dan Laku Emas berbagai karat. Berikut updatenya||"13 Mei 2026 | 12:00 WIB"|https://investor.id/market/439023/harga-emas-perhiasan-hari-ini-rabu-13-mei-2026-cek-updatenya
514|GULA Balikkan Rugi Jadi Laba di Kuartal I-2026. PT Aman Agrindo Tbk (GULA) berhasil membalikkan keadaan rugi menjadi laba, dengan membukukan laba bersih Rp 36,8 juta pada kuartal I-2026.||"13 Mei 2026 | 11:59 WIB"|https://investor.id/market/439026/gula-balikkan-rugi-jadi-laba-di-kuartal-i2026
515|Ahli Ungkap Tren Harga Emas Sesungguhnya. Harga emas diperkirakan akan tetap berfluktuasi dalam kisaran US$ 4.690–4.845.||"13 Mei 2026 | 11:58 WIB"|https://investor.id/market/439025/ahli-ungkap-tren-harga-emas-sesungguhnya
516|Lembaga Kliring Dinilai Memiliki Peran Penting dalam Perlindungan Masyarakat. Fungsi ICH khususnya dalam perdagangan berjangka komoditi dan derivatif adalah menjaga transparansi dan integritas pasar.||"13 Mei 2026 | 11:58 WIB"|https://investor.id/market/439022/lembaga-kliring-dinilai-memiliki-peran-penting-dalam-perlindungan-masyarakat
517|SMGR Bagi Dividen 100% Laba, Cek Jadwalnya. PT Semen Indonesia (Persero) Tbk (SMGR) akan membagikan dividen tunai sebesar Rp 190,8 miliar untuk tahun buku 2025.||"13 Mei 2026 | 11:37 WIB"|https://investor.id/market/439021/smgr-bagi-dividen-100-laba-cek-jadwalnya
518|Saham RAJA Ngacir, Ada Aksi Ini. Emiten Happy Hapsoro, PT Rukun Raharja Tbk (RAJA) berencana melakukan pemecahan nilai nominal saham (stock split) dengan rasio 1:5.||"13 Mei 2026 | 11:12 WIB"|https://investor.id/market/439020/saham-raja-ngacir-ada-aksi-ini
519|Waspada, Harga Emas Terkoreksi Lebih Dalam ke Level Ini. Harga emas diprediksi lanjut terkoreksi ke US$ 4.637 dipicu penguatan dolar AS dan ekspektasi suku bunga tinggi The Fed||"13 Mei 2026 | 11:12 WIB"|https://investor.id/market/439019/waspada-harga-emas-terkoreksi-lebih-dalam-ke-level-ini
520|DSSA & BREN Bisa Kena Outflow Segini Gara-gara MSCI. Saham Dian Swastatika Sentosa (DSSA) dan Barito Renewables Energy (BREN) jadi pusat tekanan terbesar dari hasil MSCI rebalancing Mei 2026.||"13 Mei 2026 | 11:07 WIB"|https://investor.id/market/439018/dssa-bren-bisa-kena-outflow-segini-garagara-msci
521|XL Smart (EXCL) Petik Hasil Merger. PT XL Smart Telecom Sejahtera Tbk (EXCL) mulai memetik hasil sinergi dari penggabungan usaha (merger). Bagaimana dampaknya terhadap kinerja?||"13 Mei 2026 | 11:00 WIB"|https://investor.id/market/438940/xl-smart-excl-petik-hasil-merger
522|Emiten Prajogo Pangestu (CDIA) Tebar Dividen Tunai, Segini Nilainya. Emiten milik konglomerat Prajogo Pangestu, PT Chandra Daya Investasi Tbk (CDIA) akan membagikan dividen tunai tahun buku 2025.||"13 Mei 2026 | 10:51 WIB"|https://investor.id/market/439016/emiten-prajogo-pangestu-cdia-tebar-dividen-tunai-segini-nilainya
523|Harga Emas Antam (ANTM), UBS, dan Galeri 24 di Pegadaian, Rabu 13 Mei 2026. Harga emas Antam (ANTM), UBS, dan Galeri 24 di Pegadaian hari ini, Rabu (13/5/2025). Cek update lengkapnya||"13 Mei 2026 | 10:39 WIB"|https://investor.id/market/439015/harga-emas-antam-antm-ubs-dan-galeri-24-di-pegadaian-rabu-13-mei-2026
524|KEEN Menang Tender PLTA Pakkat 2 dari PLN, Kapasitas 45 MW. Kencana Energi Lestari Tbk (KEEN) kembali mencatatkan langkah strategis dalam pengembangan EBT.||"13 Mei 2026 | 10:19 WIB"|https://investor.id/market/439014/keen-menang-tender-plta-pakkat-2dari-pln-kapasitas-45-mw
525|Saham-Saham Anti Boncos, Ada yang Mentok ARA. Sejumlah saham anti boncos dan masuk daftar top gainers saat IHSG hari ini anjlok pada sejam perdagangan, ada yang mentok ARA||"13 Mei 2026 | 10:13 WIB"|https://investor.id/market/439013/sahamsaham-anti-boncos-ada-yang-mentok-ara
526|Saham BBRI Berbalik Arah, Ini Pemicunya. Saham Bank Rakyat Indonesia (BBRI) berbalik merah pada sesi I 13 Mei.||"13 Mei 2026 | 10:05 WIB"|https://investor.id/market/439011/saham-bbri-berbalik-arah-ini-pemicunya
527|Harga Emas Lesu Jelang Pertemuan Trump dan Xi Jinping. Harga emas hari ini lesu jelang pertemuan Trump-Xi Jinping, pasar juga mencermati inflasi AS dan arah suku bunga The Fed||"13 Mei 2026 | 09:46 WIB"|https://investor.id/market/439010/harga-emas-lesu-jelang-pertemuan-trump-dan-xi-jinping
528|Saham Melejit 139% Disuspensi BEI. Bursa Efek Indonesia (BEI) melakukan suspensi atau penghentian sementara terhadap satu saham, mulai sesi I perdagangan, Rabu (13/5/2026).||"13 Mei 2026 | 09:41 WIB"|https://investor.id/market/439009/saham-melejit-139-disuspensi-bei
529|Google Ungkap IPOT Unggul di Proteksi Keamanan Digital. Google menyoroti IPOT sebagai sekuritas dengan proteksi keamanan digital dan anti-phishing yang kuat di Indonesia||"13 Mei 2026 | 09:31 WIB"|https://investor.id/market/439008/google-ungkap-ipot-unggul-di-proteksi-keamanan-digital
530|Siap-siap Pengumuman MSCI yang Lebih Krusial. Yang perlu dicermati ke depan adalah MSCI Market Accessibility Review pada Juni 2026 sebagai katalis yang lebih substansial.||"13 Mei 2026 | 09:24 WIB"|https://investor.id/market/439007/siapsiappengumuman-msci-yang-lebih-krusial
531|18 Saham RI Dicoret dari MSCI, Net Sell Asing Nyaris Rp 50 Triliun. MSCI resmi mengumumkan hasil tinjauan indeks global edisi Mei 2026. Sejumlah saham dicoret, ada pula yang diturunkan. Bagaimana dampaknya?||"13 Mei 2026 | 09:10 WIB"|https://investor.id/market/439004/18-saham-ri-dicoret-dari-msci-net-sell-asing-nyaris-rp-50-triliun
532|Nilai Tukar Rupiah Hari Ini, Rabu 13 Mei 2026: Terbentur Tekanan. ​​​​​​​Nilai tukar (kurs) rupiah hari ini pada Rabu (13/5/2026) terpantau terus merosot. Rupiah melemah ke level ini.||"13 Mei 2026 | 09:09 WIB"|https://investor.id/market/439006/nilai-tukar-rupiah-hari-ini-rabu-13-mei-2026-terbentur-tekanan
533|IHSG Longsor, 5 Saham Justru Melonjak Tajam. IHSG hari ini dibuka longsor 1,38%. 5 saham justru melonjak tajam dan masuk daftar top gainers, bahkan ada yang ARA||"13 Mei 2026 | 09:08 WIB"|https://investor.id/market/439005/ihsg-longsor-5-saham-justru-melonjak-tajam
534|Saham Menukik 47% Masuk UMA. Bursa Efek Indonesia (BEI) memantau pergerakan Unusual Market Activity (UMA) terhadap satu saham emiten, pada Rabu (13/5/2026).||"13 Mei 2026 | 08:54 WIB"|https://investor.id/market/439003/saham-menukik-47-masuk-uma
535|Harga Perak Antam (ANTM) Hari Ini, Rabu 13 Mei 2026: Lompat Tinggi. Harga perak Antam (ANTM) hari ini pada Rabu (13/5/2026) terpantau naik tinggi. Harga perak Antam melaju ke level ini.||"13 Mei 2026 | 08:49 WIB"|https://investor.id/market/439001/harga-perak-antam-antm-hari-ini-rabu-13-mei-2026-lompat-tinggi
536|Brigit Biofarmaka (OBAT) Tebar Dividen Rp 5,1 Miliar di Tengah Ekspansi Agresif. Brigit Biofarmaka Teknologi (OBAT) membagikan dividen Rp5,1 miliar di tengah ekspansi agresif bisnis herbal, suplemen, dan kosmetik nasional||"13 Mei 2026 | 08:39 WIB"|https://investor.id/market/438998/brigit-biofarmaka-obat-tebar-dividen-rp-51-miliar-di-tengah-ekspansi-agresif
537|Asing Kabur, Saham Ini Dihajar Habis-habisan. Asing mencetak transaksi jual bersih (net sell), saat IHSG, Selasa (12/5/2026), ditutup melemah. Saham ANTM, BMRI dan CUAN dilepas asing.||"13 Mei 2026 | 08:36 WIB"|https://investor.id/market/438997/asing-kabur-saham-ini-dihajar-habishabisan
538|Harga Emas Antam (ANTM) Hari Ini, Rabu 13 Mei 2026: Anjlok Tajam. Harga emas Antam (ANTM) terpantau anjlok tajam pada Rabu (13/5/2026). Cek juga harga beli kembali (buyback) emas Antam||"13 Mei 2026 | 08:27 WIB"|https://investor.id/market/438996/harga-emas-antam-antm-hari-ini-rabu-13-mei-2026-anjloktajam
539|IHSG Bakal Tertekan Rebalancing MSCI, tapi 3 Saham Dijagokan. Indeks harga saham gabungan (IHSG) diprediksi akan melanjutkan pelemahan pada perdagangan, Rabu (13/5/2026).||"13 Mei 2026 | 08:15 WIB"|https://investor.id/market/438995/ihsg-bakal-tertekanrebalancing-msci-tapi-3-saham-dijagokan
540|AMMN, TPIA, CUAN, AMRT Keluar dari Indeks MSCI Global Standard, Kok Bisa?. Sejumlah saham non-HSC dikeluarkan MSCI dari indeks global standard.||"13 Mei 2026 | 08:05 WIB"|https://investor.id/market/438993/ammn-tpia-cuan-amrt-keluar-dari-indeks-msci-global-standard-kok-bisa
541|Saham Pilihan untuk Trading 13 Mei dan Target Harganya. IHSG bakal melemah, rekomendasi saham pilihan ISAT, MEDC, BUMI hingga BBCA untuk trading hari ini dengan target harganya||"13 Mei 2026 | 08:04 WIB"|https://investor.id/market/438992/saham-pilihan-untuk-trading-13-mei-dan-target-harganya
542|Saham-saham Ini Jadi Incaran Asing. Asing mencetak transaksi beli bersih (net buy), saat IHSG, Selasa (12/5/2026), ditutup melemah. Saham ADRO, TINS dan TLKM diborong asing.||"13 Mei 2026 | 08:01 WIB"|https://investor.id/market/438991/sahamsaham-ini-jadi-incaran-asing
543|Saham CDIA Mulai Dilahap Lagi, Harga Bisa Segini. Saham Chandra Daya Investasi (CDIA) kembali mencetak net buy asing.||"13 Mei 2026 | 07:55 WIB"|https://investor.id/market/438990/saham-cdia-mulai-dilahap-lagi-hargabisa-segini
544|IHSG Berpotensi Koreksi Lanjutan, tapi 6 Saham Siap Cuan. Indeks harga saham gabungan (IHSG) diprediksi akan melanjutkan pelemahan pada perdagangan, Rabu (13/5/2026).||"13 Mei 2026 | 07:45 WIB"|https://investor.id/market/438987/ihsg-berpotensi-koreksi-lanjutantapi-6-saham-siap-cuan
545|Ramalan Nasib Saham BRPT. Saham Barito Pacific (BRPT) tiba-tiba berbalik arah pada 12 Mei kemarin.||"13 Mei 2026 | 07:42 WIB"|https://investor.id/market/438986/ramalan-nasib-saham-brpt
546|Profil I Ketut Pasek Senjaya Putra, Direktur Utama Baru WIKA. RUPST PT Wijaya Karya Tbk (WIKA) untuk tahun buku 2025 resmi menghasilkan keputusan penting. Salah satunya, mengangkat Direktur Utama baru.||"13 Mei 2026 | 07:30 WIB"|https://investor.id/market/438985/profil-i-ketut-pasek-senjaya-putra-direktur-utama-baru-wika
547|Ray Dalio Serang Bitcoin, Michael Saylor Langsung Balas Keras. Ray Dalio kritik Bitcoin sebagai safe haven, Michael Saylor membalas keras di tengah peluang BTC menuju US$ 85.000||"13 Mei 2026 | 07:20 WIB"|https://investor.id/market/438977/ray-dalio-serang-bitcoin-michael-saylor-langsung-balas-keras
548|Harga Emas Bisa Meledak ke US$ 17.250. Harga emas diprediksi meledak ke US$ 17.250 imbas lonjakan utang Amerika Serikat. Pengusaha tambang memiliki skenario harga emas yang tinggi||"13 Mei 2026 | 07:15 WIB"|https://investor.id/market/438959/harga-emas-bisa-meledak-ke-us17250
549|Sinyal Penting Saham BBRI. Spinning bottom pasca uji MA20 3.170 menjadi sinyal awal rebound saham BBRI yang dikonfirmasi jika mampu breakout dari resistance 3.310.||"13 Mei 2026 | 07:10 WIB"|https://investor.id/market/438984/sinyal-penting-saham-bbri
550|Harga Emas Perhiasan Hari Ini, Rabu 13 Mei 2026, Cek Rinciannya. Harga emas perhiasan hari ini, Rabu (13/5/2026) di Raja Emas Indonesia, Hartadinata Abadi, dan Laku Emas dalam berbagai karat||"13 Mei 2026 | 07:00 WIB"|https://investor.id/market/438980/harga-emas-perhiasan-hari-ini-rabu-13-mei-2026-cek-rinciannya
551|Saham BBCA Masih Downtrend, Jangan-jangan Jadi Segini. Saham Bank Central Asia (BBCA) disebut masih dalam fase downtrend.||"13 Mei 2026 | 06:48 WIB"|https://investor.id/market/438979/saham-bbca-masihdowntrend-janganjangan-jadi-segini
552|Ahli Bilang Tren Harga Emas Bakal Begini. Kalangan ahli memproyeksikan harga emas akan mencapai level ini hingga akhir 2026. Prospek harga emas masih optimistis.||"13 Mei 2026 | 06:40 WIB"|https://investor.id/market/438958/ahli-bilang-tren-harga-emas-bakal-begini
553|Harga Bitcoin (BTC) Tumbang, Dihantam Inflasi AS. Harga Bitcoin (BTC) tumbang usai inflasi AS melonjak dan pasar khawatir The Fed kembali menaikkan suku bunga||"13 Mei 2026 | 06:29 WIB"|https://investor.id/market/438976/harga-bitcoin-btc-tumbang-dihantam-inflasi-as
554|Gara-gara Pengumuman MSCI. BRIDS menaksir gara-gara pengumuman MSCI bisa berdampak besar ke pasar.||"13 Mei 2026 | 06:25 WIB"|https://investor.id/market/438975/garagara-pengumuman-msci
